,judul,abstrak,kata_kunci,subjek,abstrak_baru,mix_feature,cluster_tag_sklearn,id_mahasiswa,link
0,PERANCANGAN WEBSITE EVALUASI STUDI MAHASISWA PROGRAM STUDI INFORMATIKA,"Salah satu indikator penentu kualitas perguruan tinggi dapat dilihat dari banyaknya tingkat kelulusan mahasiswa setiap tahunnya. Namun menjadi masalah kalau ada mahasiswa yang menunda-nunda waktu untuk menyelesaikan studi. Oleh karena itu Program Studi (Prodi) Informatika Universitas Kristen Duta Wacana (UKDW) selalu melakukan evaluasi akademik terhadap mahasiswanya pada bulan Juni-Juli setiap tahun. Materi evaluasi meliputi IPK, total SKS, lama studi dan status tidak aktif mahasiswa. Proses merekap data evaluasi akademik mahasiswa masih dilakukan secara manual. Proses evaluasi dilakukan dengan melihat data mahasiswa yang memenuhi syarat-syarat seperti lama studi mahasiswa > 14 semester, IPK < 2.0 dan jumlah SKS lulus di semester 4 < 36 SKS. Jika mahasiswa memenuhi salah satu syarat akan ditindaklanjuti dengan pengiriman surat pemberitahuan kepada mahasiswa calon SP1, SP2, SP3 dan drop out. Pada penelitian ini, penulis akan membuat website yang bertujuan membantu dalam proses analisis, menampilkan history dari evaluasi akademik mahasiswa dengan menggunakan metode Goal-Directed design. Pada tahapan research akan dilaukan wawancara dengan Admin dan Kaprodi Informatika. Pengujian yang akan dilakukan dengan menggunakan Heuristic Evaluation yang menghasilkan perbaikan dengan tingkat prioritas rendah. Sedangkan untuk usability testing pada 10 responden menghasilkan nilai efficiency sebesar 92% dan evaluasi user experience yang dilakukan dengan User Experience Questionnaire menghasilkan nilai excellent pada skala efisiensi dan nilai good pada ke 5 skala yaitu daya tarik, kejelasan, ketepatan, stimulasi dan kebaruan.","Evaluasi akademik mahasiswa, Goal-Directed design, Heuristic evaluation, Usability testing","L Education > L Education (General)
Q Science > QA Mathematics > QA75 Electronic computers. Computer science
T Technology > T Technology (General)",salah indikator kualitas guru tinggi tingkat kelulus mahasiswa tahun mahasiswa tunda waktu selesai studi program studi prodi informatika universitas kristen duta wacana ukdw evaluasi akademik mahasiswa juni-juli tahun materi evaluasi liput ipk total sks studi status aktif mahasiswa proses rekap data evaluasi akademik mahasiswa manual proses evaluasi data mahasiswa penuh syarat studi mahasiswa 14 semester ipk 2 0 sks lulus semester 4 36 sks mahasiswa penuh salah syarat ditindaklanjuti kirim surat pemberitahuan mahasiswa calon sp1 sp2 sp3 drop out teliti tulis website bantu proses analisis tampil history evaluasi akademik mahasiswa metode goal-directed design tahap research lauk wawancara admin kaprodi informatika uji heuristic evaluation hasil tingkat prioritas rendah usability testing 10 responden hasil nilai efficiency 92 evaluasi user experience user experience questionnaire hasil nilai excellent skala efisiensi nilai good 5 skala daya tarik stimulasi,ancang website evaluasi studi mahasiswa program studi informatika salah indikator kualitas guru tinggi kelulus mahasiswa tahun mahasiswa tunda waktu selesai studi program studi prodi informatika universitas kristen duta wacana ukdw evaluasi akademik mahasiswa juni-juli tahun materi evaluasi liput ipk total sks studi status aktif mahasiswa proses rekap data evaluasi akademik mahasiswa manual proses evaluasi data mahasiswa penuh syarat studi mahasiswa 14 semester ipk 2 0 sks lulus semester 4 36 sks mahasiswa penuh salah syarat ditindaklanjuti kirim surat pemberitahuan mahasiswa calon sp1 sp2 sp3 drop out tulis website bantu proses tampil history evaluasi akademik mahasiswa goal-directed design tahap research lauk wawancara admin kaprodi informatika uji heuristic evaluation prioritas rendah usability testing 10 responden efficiency 92 evaluasi user experience user experience questionnaire excellent skala efisiensi good 5 skala daya tarik stimulasi evaluasi akademik mahasiswa goal-directed design heuristic evaluation usability testing,5,4207,https://katalog.ukdw.ac.id/6326/
1,"PEMBANGUNAN DATA WAREHOUSE DAN DASHBOARD
JEMAAT GEREJA","Gereja-gereja di dalam lingkungan Gereja Kristen Indonesia Sinode Wilayah Jawa Tengah memiliki data jemaat berjumlah banyak yang penting untuk diolah dan dianalsis agar pengurus gereja masing-masing dapat mengerti dan memahami keadaan dalam gereja mereka masing-masing. Kemudian dari hasil olahan data ini para pengurs gereja dapat membuat keputusan yang tepat untuk membuat kehidupan jemaat gereja lebih baik lagi. Untuk mengolah dan menganalisis data yang jumalahnya banyak ini diperlukan sebuah tempat penyimpanan data yang mampu untuk mengakomodasi data dengan jumlah yang tidak sedikit tersebut. Sebuah data warehouse yang dibangun berdasarkan prinsip data warehouse oleh Kimball dapat mengakomodasi data-data jemaat tersebut. Prinsip data warehouse oleh Kimball yang menekankan dimensional model menjadi model data warehouse ini cocok untuk menyimpan dan melakukan analisis data-data jemaat tersebut. Sebuah dashboard juga dibuat untuk menyajikan data dari data warehouse melalui sebuah web service agar pengguna dapat melihat data dalam bentuk tabel dan grafik serta mengunduh data dalam bentuk dokumen PURJ. Seluruh sistem data warehouse dan dashboard sudah berhasil dibangun dengan baik sehingga dapat digunakan oleh pengguna untuk menganalisis data jemaat gereja. Masih ada beberapa kendala yang muncul, yaitu lamanya waktu yang dibutuhkan untuk menampilkan data dalam dashboard. Untuk selanjutnya dapat dilakukan penelitian serupa dengan memperbaiki desain tabel-tabel data warehouse dan penyusunan sql query supaya sistem dapat berjalan lebih baik lagi","data warehouse, prinsip Kimball, dimensional model, jemaat, GKI, web service, dashboard","B Philosophy. Psychology. Religion > BR Christianity
Q Science > QA Mathematics > QA76 Computer software
Z Bibliography. Library Science. Information Resources > ZA Information resources",gereja lingkung gereja kristen indonesia sinode wilayah jawa tengah milik data jemaat olah dianalsis urus gereja erti paham gereja hasil olah data kurs gereja putus hidup jemaat gereja olah analis data jumalahnya buah simpan data akomodasi data buah data warehouse bangun dasar prinsip data warehouse kimball akomodasi data jemaat prinsip data warehouse kimball tekan dimensional model model data warehouse cocok simpan analisis data jemaat buah dashboard saji data data warehouse buah web service data bentuk tabel grafik unduh data bentuk dokumen purj sistem data warehouse dashboard hasil bangun analis data jemaat gereja kendala muncul waktu butuh tampil data dashboard teliti desain tabel data warehouse susun sql query sistem jalan,bangun data warehouse dashboard jemaat gereja gereja lingkung gereja kristen indonesia sinode wilayah jawa tengah milik data jemaat olah dianalsis urus gereja erti paham gereja olah data kurs gereja putus hidup jemaat gereja olah analis data jumalahnya buah simpan data akomodasi data buah data warehouse bangun dasar prinsip data warehouse kimball akomodasi data jemaat prinsip data warehouse kimball tekan dimensional model model data warehouse cocok simpan data jemaat buah dashboard saji data data warehouse buah web service data bentuk tabel grafik unduh data bentuk dokumen purj data warehouse dashboard bangun analis data jemaat gereja kendala muncul waktu butuh tampil data dashboard desain tabel data warehouse susun sql query jalan data warehouse prinsip kimball dimensional model jemaat gki web service dashboard,3,3905,https://katalog.ukdw.ac.id/2532/
2,"DESAIN ANTARMUKA VISUALISASI PROFIL PADUKUHAN MENGGUNAKAN METODE USER CENTERED DESIGN STUDI KASUS PADUKUHAN DUWET III BANJARHARJO, KALIBAWANG, KULON PROGO","Peranan teknologi dalam mencari sebuah informasi kini sangatlah tidak tabu lagi. Dimana siapapun dapat mencari sebuah informasi yang dibutuhkan dengan cepat melalui teknolgi yang semakin canggih tentunya terhubung dengan sebuah internet atau jaringan. Banyak sekali macam-macam bentuk informasi, salah satunya informasi profil padukuhan. Profil padukuhan kali ini disajikan dengan berbeda, yakni dengan memvisualisasikannya kedalam sistem dashboard. Dengn tujuan pengunjung dapat mendapatkan data dengan cepat serta mengambil kesimpulan tentang sebuah data profil padukuhan. Dalam penelitian ini, sistem dashboard yang berkaitan dengan bentuk visualisasi penyajian data maupun informasi menggunakan metode User Centered Design. Dengan mengutamakan kebutuhan pengguna. Dengan hasil pengujian menggunakan System Usability Scale dan Performance Metrics dan mendapatkan hasil Combining metrics task success sebesar 89% untuk sistem admin,83,33% untuk sistem pengunjung. Time on task sebesar 64% untuk sistem admin, 72% untuk sistem pengunjung, error untuk sistem admin 78%, sistem pengunjung sebesar 70%, efficiency untuk sistem admin sebesar 91%, dan 88% untuk sistem pengunjung. Hasil akhir dari pengujian sistem ini dapat digunakan dengan baik oleh pengguna.","User centered design, Usability testing, Profil padukuhan","Q Science > QA Mathematics > QA76 Computer software
T Technology > T Technology (General)
Z Bibliography. Library Science. Information Resources > ZA Information resources > ZA4050 Electronic information resources
Z Bibliography. Library Science. Information Resources > ZA Information resources > ZA4450 Databases",peran teknologi cari buah informasi tabu cari buah informasi butuh cepat teknolgi canggih hubung buah internet jaring bentuk informasi salah informasi profil padukuhan profil padukuhan saji beda visualisasi sistem dashboard dengn unjung data cepat ambil simpul buah data profil padukuhan teliti sistem dashboard kait bentuk visualisasi saji data informasi metode user centered design utama butuh hasil uji system usability scale performance metrics hasil combining metrics task success 89 sistem admin 83 33 sistem unjung time on task 64 sistem admin 72 sistem unjung error sistem admin 78 sistem unjung 70 efficiency sistem admin 91 88 sistem unjung hasil uji sistem,desain antarmuka visualisasi profil padukuhan user centered design studi padukuhan duwet iii banjarharjo kalibawang kulon progo peran teknologi cari buah tabu cari buah butuh cepat teknolgi canggih hubung buah internet jaring bentuk salah profil padukuhan profil padukuhan saji beda visualisasi dashboard dengn unjung data cepat ambil simpul buah data profil padukuhan dashboard kait bentuk visualisasi saji data user centered design utama butuh uji usability scale performance metrics combining metrics task success 89 admin 83 33 unjung time on task 64 admin 72 unjung error admin 78 unjung 70 efficiency admin 91 88 unjung uji user centered design usability testing profil padukuhan,5,4044,https://katalog.ukdw.ac.id/6814/
3,ANALISIS PENATAAN JARINGAN HOTSPOT SEAMLESS DENGAN METODE WDS DI LINGKUNGAN UKDW,"Kegagalan koneksi saat berpindah dari satu tempat ke tempat lain bisa disebabkan oleh banyak faktor, faktor kegagalan koneksi adalah berbedanya nama SSID , dan tingkat reliability yang rendah di jaringan internal asrama UKDW Babadan. Untuk mengatasi permasalahan tersebut, dapat diterapkan metode WDS (Wireless Distribution System). Metode ini memungkinkan pengaksesan jaringan yang lebih fleksibel untuk roaming.
Metode WDS yang diterapkan di asrama UKDW Babadan diharapkan bisa meningkatkan reliability dan fleksibelitas saat melakukan roaming. Metode WDS berfungsi menghilangkan halangan saat pengaksesan dilakukan, karena menggunakan channel width, SSID, dan Frequency yang sama. WDS berbentuk seperti repeater yang berfungsi untuk memancarkan sinyal kembali. Dalam penelitian ini parameter yang digunakan untuk pengujian, antara lain throughput, packet loss, jitter. Pengujian ini berguna untuk mengetahui kinerja jaringan sebelum WDS dan setelah WDS.
	Berdasarkan hasil penelitian dan analisis menunjukan bahwa kinerja WDS mengalami penurunan throughput 50.55%. untuk bagian Dorm pria, dan 69.35%  untuk Dorm wanita. Jumlah jitter dan packet loss mengalami peningkatan yang cukup signifikan. Hasil reliability mengalami peningkatan sebesar 97.5% untuk Dorm Pria, dan 97.64% untuk Dorm wanita. Berdasarkan pada kualitas Throughput penggunaan WDS mengalami penurunan, sedangkan dari segi reliability mengalami peningkatan.","WDS, Repeater, Reliability,Quality of Service, Throughput",Q Science > QA Mathematics > QA75 Electronic computers. Computer science,gagal koneksi pindah faktor faktor gagal koneksi beda nama ssid tingkat reliability rendah jaring internal asrama ukdw babad terap metode wds wireless distribution system metode akses jaring fleksibel roaming metode wds terap asrama ukdw babad harap tingkat reliability fleksibelitas roaming metode wds fungsi hilang halang akses channel width ssid frequency wds bentuk repeater fungsi pancar sinyal teliti parameter uji throughput packet loss jitter uji jaring wds wds dasar hasil teliti analisis wds alami turun throughput 50 55 dorm pria 69 35 dorm wanita jitter packet loss alami tingkat signifikan hasil reliability alami tingkat 97 5 dorm pria 97 64 dorm wanita dasar kualitas throughput wds alami turun segi reliability alami tingkat,tata jaring hotspot seamless wds lingkung ukdw gagal koneksi pindah faktor faktor gagal koneksi beda nama ssid reliability rendah jaring internal asrama ukdw babad terap wds wireless distribution akses jaring fleksibel roaming wds terap asrama ukdw babad harap reliability fleksibelitas roaming wds fungsi hilang halang akses channel width ssid frequency wds bentuk repeater fungsi pancar sinyal parameter uji throughput packet loss jitter uji jaring wds wds dasar wds alami turun throughput 50 55 dorm pria 69 35 dorm wanita jitter packet loss alami signifikan reliability alami 97 5 dorm pria 97 64 dorm wanita dasar kualitas throughput wds alami turun segi reliability alami wds repeater reliability quality of service throughput,1,3866,https://katalog.ukdw.ac.id/1074/
4,PERANCANGAN APLIKASI MONITORING JUMLAH KALORI SEBAGAI UPAYA PENCEGAHAN PENYAKIT DIABETES MELLITUS BERBASIS ANDROID,"Masih banyak orang yang kurang memperhatikan perihal kalori, baik itu jumlah kebutuhan kalori tubuh maupun jumlah kalori yang telah dikonsumsi sehari-hari. Salah satu faktor penyebab hal tersebut adalah sulitnya menghitung jumlah kalori itu sendiri secara manual. Sedangkan untuk berkonsultasi dengan ahli gizi mengenai kalori rata-rata membutuhkan biaya yang mahal. Hal ini sangat beresiko terhadap kesehatan, terutama bagi orang yang memiliki potensi mengidap penyakit, contohnya adalah penyakit diabetes mellitus. Oleh karena itu, dibuatlah sebuah aplikasi monitoring jumlah kalori sebagai upaya pencegahan penyakit diabetes mellitus berbasis Android.
Perancangan aplikasi ini menerapkan metode goal directed design (GDD) yang terdiri dari 6 tahap yaitu Research, Requirements, Modelling, Framework, Refinement, dan Support. Pada penelitian ini dilakukan pengujian usability dengan menggunakan 3 aspek usability yaitu effectiveness, efficiency, dan satisfaction sesuai dengan standar ISO-9241-11. Nilai effectiveness diperoleh dengan menghitung completion rate. Nilai efficiency diperoleh dengan menghitung time on task yang kemudian di normalisasi. Dan nilai satisfaction diperoleh melalui kuesioner SUS yang diolah.
Hasil yang diperoleh berdasarkan pengujian kepada 40 responden terhadap aplikasi diperoleh nilai effectiveness sebesar 97%, nilai efficiency sebesar 69%, dan nilai satisfaction pengguna sebesar 86.75%. Kemudian dapat diketahui bahwa dapat diketahui bahwa sebanyak 92.5% responden merasa terbantu dalam memantau jumlah kalori yang mereka konsumsi dengan adanya aplikasi ini. Selain itu, sebanyak 97.5% responden merasa lebih waspada terhadap resiko penyakit diabetes setelah menggunakan aplikasi ini dan sebanyak 62.5% responden mengatakan bahwa mereka akan kembali menggunakan aplikasi ini untuk pemakaian sehari-hari di kemudian hari. Maka dapat disimpulkan bahwa tujuan perancangan Aplikasi Monitoring Jumlah Kalori Sebagai Upaya Pencegahan Penyakit Diabetes Mellitus Berbasis Android ini sudah tercapai.","Usability, Goal-directed design, Mobile application","Q Science > QA Mathematics > QA76 Computer software
R Medicine > RA Public aspects of medicine
T Technology > T Technology (General)",perhati perihal kalori butuh kalori tubuh kalori konsumsi salah faktor sulit hitung kalori manual konsultasi ahli gizi kalori rata butuh biaya mahal resiko sehat utama milik potensi idap sakit contoh sakit diabetes mellitus buah aplikasi monitoring kalori upaya cegah sakit diabetes mellitus bas android ancang aplikasi terap metode goal directed design gdd 6 tahap research requirements modelling framework refinement support teliti uji usability 3 aspek usability effectiveness efficiency satisfaction sesuai standar iso-9241-11 nilai effectiveness hitung completion rate nilai efficiency hitung time on task normalisasi nilai satisfaction kuesioner sus olah hasil dasar uji 40 responden aplikasi nilai effectiveness 97 nilai efficiency 69 nilai satisfaction 86 75 92 5 responden bantu pantau kalori konsumsi aplikasi 97 5 responden waspada resiko sakit diabetes aplikasi 62 5 responden aplikasi pakai simpul ancang aplikasi monitoring kalori upaya cegah sakit diabetes mellitus bas android capai,ancang aplikasi monitoring kalori upaya cegah sakit diabetes mellitus bas android perhati perihal kalori butuh kalori tubuh kalori konsumsi salah faktor sulit hitung kalori manual konsultasi ahli gizi kalori rata butuh biaya mahal resiko sehat utama milik potensi idap sakit contoh sakit diabetes mellitus buah aplikasi monitoring kalori upaya cegah sakit diabetes mellitus bas android ancang aplikasi terap goal directed design gdd 6 tahap research requirements modelling framework refinement support uji usability 3 aspek usability effectiveness efficiency satisfaction sesuai standar iso-9241-11 effectiveness hitung completion rate efficiency hitung time on task normalisasi satisfaction kuesioner sus olah dasar uji 40 responden aplikasi effectiveness 97 efficiency 69 satisfaction 86 75 92 5 responden bantu pantau kalori konsumsi aplikasi 97 5 responden waspada resiko sakit diabetes aplikasi 62 5 responden aplikasi pakai simpul ancang aplikasi monitoring kalori upaya cegah sakit diabetes mellitus bas android capai usability goal-directed design mobile application,0,3978,https://katalog.ukdw.ac.id/5043/
5,ANALISIS SENTIMEN BERITA SAHAM MENGGUNAKAN ALGORITMA NAIVE BAYES,"Banyak cara yang digunakan untuk dapat menginvestasikan harta kita, salah satunya cara adalah dengan berinvestasi di saham. Secara sederhana saham dapat diartikan sebagai tanda penyertaan atau bukti kepemilikan seseorang atau badan dalam suatu perusahaan. Setiap perusahaan yang mengeluarkan saham pasti memiliki trend masing-masing yang memiliki sentimen tertentu yang tentunya akan berpengaruh terhadap pergerakan harga saham. Setiap hal yang mempengaruhi pergerakan saham tentunya akan dimuat dalam situs berita. Tujuan dari penelitian ini adalah untuk membangun sistem yang memberikan informasi terhadap sentimen berita untuk suatu perusahaan tertentu. Sehingga investor dapat terbantu dalam pengambilan keputusan untuk berinvestasi di perusahaan tersebut. Pada penelitian ini, penulis menggunakan data dari situs berita saham kontan.com. Data diambil menggunakan grabber, kemudian dilakukan pemberian label secara manual. Selanjutnya, dilakukan proses preprocessing seperti case folding, dan stemming, serta konfigurasi lain yang dibutuhkan seperti penghapusan kata singkatan, penghapusan kata penghubung, dan angka. Proses klasifikasi dilakukan menggunakan metode Naive Bayes. Pengujian dengan fitur TF-IDF menunjukkan rata-rata akurasi yang dihasilkan sebesar 76,79%. Pemilihan fitur sebesar 100% dari fitur teratas memberikan nilai accuracy tertinggi. Sedangkan pengujian dengan fitur TF-IDF Bigram menghasilkan nilai rata-rata akurasi sebesar 77.13%.","Klasifikasi Teks, Naive Bayes, Berita Saham, Analisa Sentimen","H Social Sciences > HB Economic Theory
Q Science > QA Mathematics > QA75 Electronic computers. Computer science",investasi harta salah investasi saham sederhana saham tanda bukti milik badan usaha usaha saham milik trend milik sentimen pengaruh gera harga saham pengaruh gera saham muat situs berita teliti bangun sistem informasi sentimen berita usaha investor bantu ambil putus investasi usaha teliti tulis data situs berita saham kontan com data ambil grabber label manual proses preprocessing case folding stemming konfigurasi butuh hapus singkat hapus hubung angka proses klasifikasi metode naive bayes uji fitur tf-idf rata akurasi hasil 76 79 pilih fitur 100 fitur nilai accuracy tinggi uji fitur tf-idf bigram hasil nilai rata akurasi 77 13,sentimen berita saham algoritma naive bayes investasi harta salah investasi saham sederhana saham tanda bukti milik badan usaha usaha saham milik trend milik sentimen pengaruh gera harga saham pengaruh gera saham muat situs berita bangun sentimen berita usaha investor bantu ambil putus investasi usaha tulis data situs berita saham kontan com data ambil grabber label manual proses preprocessing case folding stemming konfigurasi butuh hapus singkat hapus hubung angka proses klasifikasi naive bayes uji fitur tf-idf rata akurasi 76 79 pilih fitur 100 fitur accuracy tinggi uji fitur tf-idf bigram rata akurasi 77 13 klasifikasi teks naive bayes berita saham analisa sentimen,3,3886,https://katalog.ukdw.ac.id/4166/
6,EVALUASI DAN PERANCANGAN ANTARMUKA SITUS E-COMMERCE PLANET BOOK STORE,"Situs Planet Book Store adalah salah satu situs jual beli buku dimana pengguna bisa melakukan pemesanan dan pembelian buku pada situs tersebut. Antarmuka yang baik sangat penting dalam sebuah situs jual beli karena pengguna akan melakukan interaksi pada situs tersebut. Maka dari itu pengujian usabilitas serta peningkatan usabilitas diperlukan agar pengguna dapat dengan  mudah berinteraksi dengan situs tersebut.  Penelitian ini dilakukan untuk memperbaiki antarmuka yang dirasa perlu untuk diperbaiki dari situs ini. Untuk peneliti mengetahui usabilitas atau kebergunaan situs ini, peneliti menggunakan usability testing dengan menggunakan prinsip ISO 9241-11 yang terdiri dari 3 pengukuran yaitu efektifitas (effectiveness),efisiensi (efficiency), serta kepuasan (satisfaction). Dari hasil akhir penelitian ini terdapat peningkatan yaitu nilai rata-rata efektifitas dengan completion rate mengalami peningkatan dari 64% menjadi 92%. Kemudian nilai rata-rata efisiensi dengan overall relative efficiency mengalami peningkatan dari 43% menjadi 84%, serta nilai rata-rata kepuasan dengan kuisioner System Usability Scale (SUS) juga mengalami peningkatan dari 53,87  menjadi 85,25.","Usability testing, ISO 9241-11","Q Science > QA Mathematics > QA75 Electronic computers. Computer science
Q Science > QA Mathematics > QA76 Computer software",situs planet book store salah situs jual beli buku mesan beli buku situs antarmuka buah situs jual beli interaksi situs uji usabilitas tingkat usabilitas mudah interaksi situs teliti antarmuka situs teliti usabilitas situs teliti usability testing prinsip iso 9241-11 3 ukur efektifitas effectiveness efisiensi efficiency puas satisfaction hasil teliti tingkat nilai rata efektifitas completion rate alami tingkat 64 92 nilai rata efisiensi overall relative efficiency alami tingkat 43 84 nilai rata puas kuisioner system usability scale sus alami tingkat 53 87 85 25,evaluasi ancang antarmuka situs e-commerce planet book store situs planet book store salah situs jual beli buku mesan beli buku situs antarmuka buah situs jual beli interaksi situs uji usabilitas usabilitas mudah interaksi situs antarmuka situs usabilitas situs usability testing prinsip iso 9241-11 3 ukur efektifitas effectiveness efisiensi efficiency puas satisfaction rata efektifitas completion rate alami 64 92 rata efisiensi overall relative efficiency alami 43 84 rata puas kuisioner usability scale sus alami 53 87 85 25 usability testing iso 9241-11,5,4132,https://katalog.ukdw.ac.id/6843/
