,judul,abstrak,kata_kunci,subjek,abstrak_baru,mix_feature,cluster_tag_sklearn,id_mahasiswa,link
116,PENGEMBANGAN SISTEM PENJADWALAN DENGAN PRESENSI QR DAN TRACING JEMAAT GEREJA KATOLIK,"Paroki Santa Maria Assumpta Klaten, merupakan gereja Katholik yang  berada di Jl. Andalas No.24, Sikenong, Kabupaten, Kec. Klaten Tengah, Kabupaten  Klaten, Jawa Tengah. Gereja ini memiliki banyak umat yang menghadiri acara-acara yang diadakan oleh gereja tersebut. Acara ini memiliki acara-acara yang diadakan setiap hari atau mingguan. Namun, pengelolaan acara pada gereja ini masih terbilang manual. Selain itu, di masa pandemi covid-19 kapasitas di gereja  ini dibatasi menjadi 260 kursi atau sekitar 30% dari kapasitas normal. Melihat situasi tersebut, gereja ini membutuhkan sebuah sistem yang dapat melacak umat jika ternyata ada umat yang terkena virus covid-19 ketika menghadiri suatu acara. Oleh karena itu dibutuhkan sistem pengelolaan acara yang dapat membantu pihak pengelola acara gereja untuk mengelola acara-acara yang ada dan melakukan pelacakan umat yang terdaftar di gereja tersebut. Sistem tersebut adalah sebuah website penjadwalan yang juga terintegrasi dengan aplikasi mobile dalam melakukan presensi umat. Website ini dikembangkan untuk mengelola acara yang  ada seperti membuat acara baru, membuat kelas acara baru, mendaftarkan peserta,  melihat jadwal acara dan kelas acara, serta melihat dan mengunduh presensi setiap kelas acara. Selain fitur-fitur tersebut, sistem penjadwalan ini juga dapat melakukan tracing pada umat-umat yang telah terdaftar. Fitur tracing ini dibutuhkan untuk melihat siapa saja umat yang menghadiri atau berdekatan dengan umat yang terkena virus covid-19 untuk melakukan tindakan lebih lanjut. Kemudian, aplikasi mobile  juga dikembangkan untuk membantu umat gereja untuk melakukan scanning QR Code sebagai bentuk presensi atas sebuah acara yang dihadiri oleh umat. Dari penjelasan di atas, maka dapat disimpulkan bahwa pengembangan website penjadwalan yang terintegrasi dengan aplikasi pemindai mobile-based dapat membantu penjadwalan dan pengelolaan acara menjadi lebih mudah dan praktis. Sistem tracing juga akan membantu pengguna untuk melakukan pengecekan kegiatan umat dengan lebih mudah. Sistem ini juga diharapkan akan mudah untuk dimengerti oleh pihak administrasi gereja dan umat dalam penggunaannya serta dapat mengurangi kerumunan umat ketika melakukan  presensi di gereja pada saat menghadiri suatu acara serta dapat mengambil keputusan lebih cepat terkait dengan penyebaran virus covid-19.","QR Code, Penjadwalan, Mobile-based","B Philosophy. Psychology. Religion > BL Religion
T Technology > T Technology (General)",paroki santa maria assumpta klaten gereja katholik jl andalas no 24 sikenong kabupaten kec klaten tengah kabupaten klaten jawa tengah gereja milik umat hadir acara gereja acara milik acara minggu kelola acara gereja bilang manual pandemi covid-19 kapasitas gereja batas 260 kursi 30 kapasitas normal situasi gereja butuh buah sistem lacak umat umat virus covid-19 hadir acara butuh sistem kelola acara bantu kelola acara gereja kelola acara lacak umat daftar gereja sistem buah website jadwal integrasi aplikasi mobile presensi umat website kembang kelola acara acara kelas acara daftar jadwal acara kelas acara unduh presensi kelas acara fitur-fitur sistem jadwal tracing umat daftar fitur tracing butuh umat hadir umat virus covid-19 tindak aplikasi mobile kembang bantu umat gereja scanning qr code bentuk presensi buah acara hadir umat simpul kembang website jadwal integrasi aplikasi pindai mobile-based bantu jadwal kelola acara mudah praktis sistem tracing bantu kece giat umat mudah sistem harap mudah erti administrasi gereja umat kerumun umat presensi gereja hadir acara ambil putus cepat kait sebar virus covid-19,kembang jadwal presensi qr tracing jemaat gereja katolik paroki santa maria assumpta klaten gereja katholik jl andalas no 24 sikenong kabupaten kec klaten tengah kabupaten klaten jawa tengah gereja milik umat hadir acara gereja acara milik acara minggu kelola acara gereja bilang manual pandemi covid-19 kapasitas gereja batas 260 kursi 30 kapasitas normal situasi gereja butuh buah lacak umat umat virus covid-19 hadir acara butuh kelola acara bantu kelola acara gereja kelola acara lacak umat daftar gereja buah website jadwal integrasi aplikasi mobile presensi umat website kembang kelola acara acara kelas acara daftar jadwal acara kelas acara unduh presensi kelas acara fitur-fitur jadwal tracing umat daftar fitur tracing butuh umat hadir umat virus covid-19 tindak aplikasi mobile kembang bantu umat gereja scanning qr code bentuk presensi buah acara hadir umat simpul kembang website jadwal integrasi aplikasi pindai mobile-based bantu jadwal kelola acara mudah praktis tracing bantu kece giat umat mudah harap mudah erti administrasi gereja umat kerumun umat presensi gereja hadir acara ambil putus cepat kait sebar virus covid-19 qr code jadwal mobile-based,2,4109,https://katalog.ukdw.ac.id/6293/
117,IMPLEMENTASI METODE SCRUM PADA APLIKASI MARKETPLACE SEKTOR PERTANIAN BERBASIS ANDROID,"Metode scrum diciptakan oleh Ken Schwaber dan Jeff Sutherland memiliki tujuan untuk pengembangan dan manajemen metodologi yang mengikuti prinsip – prinsip metodologi agile. Scrum adalah kerangka kerja tambahan untuk pengembangan perangkat lunak atau produk dan dapat meningkatkan kecepatan dan fleksibilitas dalam pengembangan, hal tersebut yang mendasari mengimplementasikan scrum untuk pengembangan aplikasi Duta Tani Store. Penelitian ini berfokus pada analisis implementasi scrum dan bertujuan mengetahui faktor–faktor yang mempengaruhi tingkat keberhasilan mengimplementasikan scrum, kelebihan dan kekurangan scrum, dan kualitas aplikasi menggunakan metode pengujian black box. Scrum terdiri dari empat tahap yaitu sprint planning, daily scrum, sprint review, dan sprint retrospective. Analisis keberhasilan implementasi scrum dalam pengembangan aplikasi menggunakan laporan sprint dalam bentuk burndown chart. Parameter yang digunakan adalah estimasi waktu pengerjaan tugas atau story point, waktu aktual pengerjaan tugas, dan tanggal pelaksanaan sprint. Pengujian aplikasi bertujuan untuk acceptance testing dengan cara memastikan setiap requirement yang telah dibuat pada tahap awal pengembangan telah terpenuhi dan functional testing dengan cara memvalidasi fungsional setiap fitur dan tampilan aplikasi. Parameter yang digunakan pada analisis hasil pengujian adalah tingkat completeness dari skenario pengujian setiap fitur dan tampilan aplikasi. Scrum berhasil diimplementasikan dalam pengembangan aplikasi Duta Tani Store. Terdapat lima faktor yang mempengaruhi implementasi scrum berdasarkan hasil burndown chart tiap sprint. Ditemukan lima kelebihan dan tiga kekurangan scrum. Hasil pengujian aplikasi memiliki nilai completeness 100% dengan total tujuh puluh lima skenario pengujian.","Scrum, Black Box, Sprint, Burndown Chart","H Social Sciences > HF Commerce
Q Science > QA Mathematics > QA76 Computer software
S Agriculture > S Agriculture (General)
T Technology > T Technology (General)",metode scrum cipta ken schwaber jeff sutherland milik kembang manajemen metodologi prinsip prinsip metodologi agile scrum kerangka kembang perangkat lunak produk tingkat cepat fleksibilitas kembang dasar implementasi scrum kembang aplikasi duta tani store teliti fokus analisis implementasi scrum faktor faktor pengaruh tingkat hasil implementasi scrum scrum kualitas aplikasi metode uji black box scrum tahap sprint planning daily scrum sprint review sprint retrospective analisis hasil implementasi scrum kembang aplikasi lapor sprint bentuk burndown chart parameter estimasi waktu tugas story point waktu aktual tugas tanggal laksana sprint uji aplikasi acceptance testing requirement tahap kembang penuh functional testing memvalidasi fungsional fitur tampil aplikasi parameter analisis hasil uji tingkat completeness skenario uji fitur tampil aplikasi scrum hasil implementasi kembang aplikasi duta tani store faktor pengaruh implementasi scrum dasar hasil burndown chart sprint temu scrum hasil uji aplikasi milik nilai completeness 100 total tujuh puluh skenario uji,implementasi scrum aplikasi marketplace sektor tani bas android scrum cipta ken schwaber jeff sutherland milik kembang manajemen metodologi prinsip prinsip metodologi agile scrum kerangka kembang perangkat lunak produk cepat fleksibilitas kembang dasar implementasi scrum kembang aplikasi duta tani store fokus implementasi scrum faktor faktor pengaruh implementasi scrum scrum kualitas aplikasi uji black box scrum tahap sprint planning daily scrum sprint review sprint retrospective implementasi scrum kembang aplikasi lapor sprint bentuk burndown chart parameter estimasi waktu tugas story point waktu aktual tugas tanggal laksana sprint uji aplikasi acceptance testing requirement tahap kembang penuh functional testing memvalidasi fungsional fitur tampil aplikasi parameter uji completeness skenario uji fitur tampil aplikasi scrum implementasi kembang aplikasi duta tani store faktor pengaruh implementasi scrum dasar burndown chart sprint temu scrum uji aplikasi milik completeness 100 total tujuh puluh skenario uji scrum black box sprint burndown chart,2,4041,https://katalog.ukdw.ac.id/4297/
118,SISTEM TEMU KEMBALI TEMPAT PENYIMPANAN KODE PROGRAM JAVA DENGAN PENDEKATAN RELASI CLASS,"Penelitian ini bertujuan membangun sebuah sistem temu kembali informasi untuk kode program bahasa Java dalam sebuah penyimpanan kode program (repository). Jumlah dokumen kode program yang besar dalam sebuah repository menyebabkan informasi menjadi lebih sulit untuk ditemukan. Hal ini terjadi karena pengembangan sebuah aplikasi / software terus-menerus dilakukan, dan terjadi penambahan fitur seiring perkembangan waktu. Penelitian ini akan melakukan proses pengolahan kode program bahasa java dalam repository hingga ke tahap menjadi sebuah indeks yang dapat diakses dengan melakukan pencarian. Kode program java akan melalui tahap preprocessing hingga terbentuk dokumen JSON berisi informasi kode program yang akan diindeks. Dokumen JSON ini kemudian akan menjadi input bagi SOLR dan neo4j dan kemudian akan diindeks. Indeks ini akan berisi informasi tentang kode program, secara spesifik juga menggambarkan relasi antar class. Indeks yang terbentuk akan diakses melalui proses temu kembali informasi. Hasil penelitian ini adalah sebuah aplikasi yang mampu melakukan preprocessing terhadap dokumen kode program java, melakukan proses indexing, serta melakukan temu kembali informasi yang memberikan output berupa hasil pencarian dari query yang diberikan oleh pengguna kepada sistem.","Temu kembali informasi, Tempat penyimpanan kode program, Bahasa pemrograman Java, Relasi class, Struktur data, Inverted index","L Education > L Education (General)
T Technology > T Technology (General)
Z Bibliography. Library Science. Information Resources > ZA Information resources",teliti bangun buah sistem temu informasi kode program bahasa java buah simpan kode program repository dokumen kode program buah repository informasi sulit temu kembang buah aplikasi software fitur iring kembang waktu teliti proses olah kode program bahasa java repository tahap buah indeks akses cari kode program java tahap preprocessing bentuk dokumen json isi informasi kode program indeks dokumen json input solr neo4j indeks indeks isi informasi kode program spesifik gambar relasi class indeks bentuk akses proses temu informasi hasil teliti buah aplikasi preprocessing dokumen kode program java proses indexing temu informasi output upa hasil cari query sistem,temu simpan kode program java relasi class bangun buah temu kode program bahasa java buah simpan kode program repository dokumen kode program buah repository sulit temu kembang buah aplikasi software fitur iring kembang waktu proses olah kode program bahasa java repository tahap buah indeks akses cari kode program java tahap preprocessing bentuk dokumen json isi kode program indeks dokumen json input solr neo4j indeks indeks isi kode program spesifik gambar relasi class indeks bentuk akses proses temu buah aplikasi preprocessing dokumen kode program java proses indexing temu output upa cari query temu simpan kode program bahasa pemrograman java relasi class struktur data inverted index,2,4128,https://katalog.ukdw.ac.id/6295/
119,REPRESENTASI INFORMASI FILM DAN LAGU DAERAH BERBASIS SEMANTIC WEB,"Film dan lagu adalah karya seni yang dihasilkan dari ekspresi kesenian dengan menggunakan alat – alat seni maupun teknologi. Dengan merepresentasikan informasi film dan lagu daerah ke dalam web, maka informasi – informasi tersebut dapat disimpan dan diakses oleh banyak orang. Dalam penelitian ini, web yang akan dibuat adalah web yang merepresentasikan informasi film dan lagu daerah dengan berbasis Semantic Web. Dalam penelitian ini, digunakan metode Methontology untuk membangun ontologi. Tahapan metode Methontology dalam penelitian ini terdiri dari 4 tahap, yaitu spesifikasi, knowledge acquisition, konseptualisasi, dan implementasi. Tahap spesifikasi adalah menentukan ruang lingkup ontologi dari objek film dan lagu daerah. Tahap knowledge acquisition adalah menganalisis teks dalam buku, untuk mempelajari konsep-konsep yang ada dalam buku. Tahap konseptualisasi adalah melakukan ekstraksi data ke dalam bentuk subjek, predikat, dan objek. Tahap konseptualisasi juga akan menghasilkan diagram T-Box untuk pemodelan objek. Tahap implementasi adalah membangun ontologi film dan lagu daerah Indonesia ke dalam bentuk OWL menggunakan aplikasi Protégé.
Informasi film dan lagu daerah Indonesia dibangun dengan menggunakan bahasa pemrograman JavaScript dengan framework Vue.js. Dalam pemrograman web berbasis semantic web dalam penelitian ini, sistem dapat menghubungkan data film dan lagu daerah Indonesia dengan data di id.dbpedia.org dengan menggunakan endpoint dbpedia Indonesia. Penelitian ini melaporkan hasil dari tahap spesifikasi, knowledge acquisition, konseptualisasi, dan implementasi. Hasil akhir penelitian ini adalah representasi informasi film dan lagu daerah Indonesia berbasis semantic web.","semantic web, Methontology, film, lagu, Indonesia, endpoint, protégé, apache jena fuseki","G Geography. Anthropology. Recreation > GR Folklore
M Music and Books on Music > M Music
Q Science > QA Mathematics > QA75 Electronic computers. Computer science",film lagu karya seni hasil ekspresi seni alat alat seni teknologi representasi informasi film lagu daerah web informasi informasi simpan akses teliti web web representasi informasi film lagu daerah bas semantic web teliti metode methontology bangun ontologi tahap metode methontology teliti 4 tahap spesifikasi knowledge acquisition konseptualisasi implementasi tahap spesifikasi ruang lingkup ontologi objek film lagu daerah tahap knowledge acquisition analis teks buku ajar konsep buku tahap konseptualisasi ekstraksi data bentuk subjek predikat objek tahap konseptualisasi hasil diagram t-box model objek tahap implementasi bangun ontologi film lagu daerah indonesia bentuk owl aplikasi prot informasi film lagu daerah indonesia bangun bahasa pemrograman javascript framework vue js pemrograman web bas semantic web teliti sistem hubung data film lagu daerah indonesia data id dbpedia org endpoint dbpedia indonesia teliti lapor hasil tahap spesifikasi knowledge acquisition konseptualisasi implementasi hasil teliti representasi informasi film lagu daerah indonesia bas semantic web,representasi film lagu daerah bas semantic web film lagu karya seni ekspresi seni alat alat seni teknologi representasi film lagu daerah web simpan akses web web representasi film lagu daerah bas semantic web methontology bangun ontologi tahap methontology 4 tahap spesifikasi knowledge acquisition konseptualisasi implementasi tahap spesifikasi ruang lingkup ontologi objek film lagu daerah tahap knowledge acquisition analis teks buku ajar konsep buku tahap konseptualisasi ekstraksi data bentuk subjek predikat objek tahap konseptualisasi diagram t-box model objek tahap implementasi bangun ontologi film lagu daerah indonesia bentuk owl aplikasi prot film lagu daerah indonesia bangun bahasa pemrograman javascript framework vue js pemrograman web bas semantic web hubung data film lagu daerah indonesia data id dbpedia org endpoint dbpedia indonesia lapor tahap spesifikasi knowledge acquisition konseptualisasi implementasi representasi film lagu daerah indonesia bas semantic web semantic web methontology film lagu indonesia endpoint prot apache jena fuseki,5,3902,https://katalog.ukdw.ac.id/1120/
120,"PEMBANGUNAN DASHBOARD KERJA PRAKTIK DAN
SKRIPSI MENGGUNAKAN METODE USER CENTERED
DESIGN","Penelitian ini membangun dashboard untuk data skripsi dan kerja praktik UKDW. Sistem ini akan digunakan untuk menganalisis mahasiswa Fakultas Teknologi Informasi. Pembangunan dashboard mengacu pada Key Perfomance Indicator yang sudah disesuaikan standarisasi BAN-PT Prodi Informatika. Sistem ini dibuat menggunakan Framework Laravel dan database MYSQL. Sistem yangdibangun akan digunakan oleh dosen Prodi Informatika.Kata Kunci— Dashboard, Visualisasi, KPI","Dashboard, Visualisasi, KPI","A General Works > AS Academies and learned societies (General)
Q Science > QA Mathematics > QA75 Electronic computers. Computer science",teliti bangun dashboard data skripsi praktik ukdw sistem analis mahasiswa fakultas teknologi informasi bangun dashboard acu key perfomance indicator sesuai standar ban-pt prodi informatika sistem framework laravel database mysql sistem yangdibangun dosen prodi informatika kunci dashboard visualisasi kpi,bangun dashboard praktik skripsi user centered design bangun dashboard data skripsi praktik ukdw analis mahasiswa fakultas teknologi bangun dashboard acu key perfomance indicator sesuai standar ban-pt prodi informatika framework laravel database mysql yangdibangun dosen prodi informatika kunci dashboard visualisasi kpi dashboard visualisasi kpi,5,3848,https://katalog.ukdw.ac.id/2392/
121,PENGEMBANGAN APLIKASI WARTA JEMAAT BERBASIS ANDROID UNTUK KALANGAN LANSIA MENGGUNAKAN UJI USABILITAS,"Jemaat kalangan lanjut usia umumnya sudah memiliki kekurangan fisik. Kekurangan ini dapat menghalangi mereka untuk datang ke Gereja, sehingga sangat memerlukan warta jemaat. Aplikasi warta jemaat berbasis Android dapat membantu jemaat yang tidak hadir sehingga tetap mendapatkan informasi mengenai kegiatan gereja secara real-time. Pengembangan aplikasi diperlukan agar aplikasi lebih mudah digunakan khususnya oleh kalangan lansia.
Salah satu aplikasi warta jemaat yang telah digunakan oleh umat Paroki Klaten bernama “Gematen”. Aplikasi yang dikembangkan berbasis Android dan menggunakan framework Flutter dan telah diunggah di PlayStore. Aplikasi dibangun menggunakan basis data MySQL dan otentikasi menggunakan Firebase. Pengembangan aplikasi dikhususkan pada fungsi view pada bagian Beranda dan Jadwal untuk memudahkan penggunaan. Pengembangan berfokus pada framework Flutter dan pengolahan data pada basis data MySQL. Pengembangan aplikasi dilakukan hingga dua iterasi, dan tiap iterasi aplikasi diujikan kepada responden kalangan lansia dalam bentuk Task Scenario, System Usability Scale, dan wawancara. Pada aplikasi Gematen dilakukan dua kali
pengujian usabilitas yang didapat data yang lebih baik dari sebelumnya. Task Scenario mendapatkan penyingkatan waktu dengan rata-rata 13,8% atau sekitar 4,4 detik. Skor SUS pada iterasi kedua sudah mendapatkan diatas nilai standar 68, dengan skor 71,125 dan mendapatkan Grade C. Mayoritas responden sudah
mengaku puas dengan aplikasi yang diujikan pada iterasi kedua. Penelitian lebih lanjut yang diharapkan dari penelitian ini adalah pengembangan fitur, seperti cache, penyederhanaan kategori, fitur pengiriman pesan dengan pengguna lain, permintaan layanan misa / minyak suci, Gematen untuk platform web, dan fitur lainnya yang sesuai dengan kebutuhan Paroki Santa Maria Assumpta Klaten.","Flutter, Usability Testing, Task Scenario, System Usability Scale",Q Science > QA Mathematics > QA76 Computer software,jemaat kalang usia umum milik fisik halang gereja warta jemaat aplikasi warta jemaat bas android bantu jemaat hadir informasi giat gereja real-time kembang aplikasi aplikasi mudah kalang lansia salah aplikasi warta jemaat umat paroki klaten nama gematen aplikasi kembang bas android framework flutter unggah playstore aplikasi bangun basis data mysql otentikasi firebase kembang aplikasi fungsi view beranda jadwal mudah kembang fokus framework flutter olah data basis data mysql kembang aplikasi iterasi iterasi aplikasi uji responden kalang lansia bentuk task scenario system usability scale wawancara aplikasi gematen uji usabilitas data task scenario singkat waktu rata 13 8 4 4 detik skor sus iterasi nilai standar 68 skor 71 125 grade mayoritas responden puas aplikasi uji iterasi teliti harap teliti kembang fitur cache sederhana kategori fitur kirim pesan layan misa minyak suci gematen platform web fitur sesuai butuh paroki santa maria assumpta klaten,kembang aplikasi warta jemaat bas android kalang lansia uji usabilitas jemaat kalang usia umum milik fisik halang gereja warta jemaat aplikasi warta jemaat bas android bantu jemaat hadir giat gereja real-time kembang aplikasi aplikasi mudah kalang lansia salah aplikasi warta jemaat umat paroki klaten nama gematen aplikasi kembang bas android framework flutter unggah playstore aplikasi bangun basis data mysql otentikasi firebase kembang aplikasi fungsi view beranda jadwal mudah kembang fokus framework flutter olah data basis data mysql kembang aplikasi iterasi iterasi aplikasi uji responden kalang lansia bentuk task scenario usability scale wawancara aplikasi gematen uji usabilitas data task scenario singkat waktu rata 13 8 4 4 detik skor sus iterasi standar 68 skor 71 125 grade mayoritas responden puas aplikasi uji iterasi harap kembang fitur cache sederhana kategori fitur kirim pesan layan misa minyak suci gematen platform web fitur sesuai butuh paroki santa maria assumpta klaten flutter usability testing task scenario usability scale,0,4009,https://katalog.ukdw.ac.id/5040/
122,IMPLEMENTASI ALGORITMA DIJKSTRA UNTUK MENCARI RUMAH KOST TERDEKAT DI KODYA YOGYAKARTA BERBASIS ANDROID,"Permasalahan yang sering dihadapi oleh para mahasiswa terutama mahasiswa pendatang adalah sulitnya untuk memperoleh tempat tinggal, salah satunya adalah rumah kost. Namun beberapa mahasiswa memiliki pertimbangan tertentu dalam memilih kost-kostannya salah satunya adalah jarak tempat kost dari universitas tertentu.
Penelitian ini akan mencoba mengimplementasikan algoritma Dijkstra untuk melakukan pencarian kost terdekat di Android, pada aplikasi ini juga akan terdapat fitur pencarian jalur terpendek, filter harga maksimal, dan filter jarak maksimal. Algoritma Dijkstra merupakan salah satu algoritma untuk pencarian jarak terkecil dan jalur terpendek. Hasil pencarian jarak kost terdekat dan jalur terpendek akan dibandingkan dengan hasil dari Google Maps, proses waktu pencarian pada sistem juga akan dicatat.
Dari penelitian ini didapatkan hasil bahwa algoritma Dijkstra berhasil diimplementasikan untuk pencarian kost terdekat, pencarian kost berdasarkan filter dan pencarian jalur terpendek di Android. Pada pengujian pencarian jarak kost terdekat didapatkan hasil bahwa algoritma Dijkstra dalam mencari jarak terkecil, rata-rata selisih jaraknya hampir mendekati data dari Google Maps. Pengujian ini juga menemukan bahwa semakin jauh jarak dan jalur kost yang dicari menggunakan algoritma Dijkstra maka akan semakin lama waktu pencariannya dikarenakan semakin banyaknya verteks yang dikerjakan.","Dijkstra, Android, pencarian kost terdekat, pencarian jalur terpendek",Q Science > QA Mathematics > QA75 Electronic computers. Computer science,mahasiswa utama mahasiswa sulit tinggal salah rumah kost mahasiswa milik timbang pilih kost-kostannya salah jarak kost universitas teliti coba implementasi algoritma dijkstra cari kost android aplikasi fitur cari jalur pendek filter harga maksimal filter jarak maksimal algoritma dijkstra salah algoritma cari jarak jalur pendek hasil cari jarak kost jalur pendek banding hasil google maps proses waktu cari sistem catat teliti hasil algoritma dijkstra hasil implementasi cari kost cari kost dasar filter cari jalur pendek android uji cari jarak kost hasil algoritma dijkstra cari jarak rata selisih jarak data google maps uji temu jarak jalur kost cari algoritma dijkstra waktu cari verteks,implementasi algoritma dijkstra cari rumah kost kodya yogyakarta bas android mahasiswa utama mahasiswa sulit tinggal salah rumah kost mahasiswa milik timbang pilih kost-kostannya salah jarak kost universitas coba implementasi algoritma dijkstra cari kost android aplikasi fitur cari jalur pendek filter harga maksimal filter jarak maksimal algoritma dijkstra salah algoritma cari jarak jalur pendek cari jarak kost jalur pendek banding google maps proses waktu cari catat algoritma dijkstra implementasi cari kost cari kost dasar filter cari jalur pendek android uji cari jarak kost algoritma dijkstra cari jarak rata selisih jarak data google maps uji temu jarak jalur kost cari algoritma dijkstra waktu cari verteks dijkstra android cari kost cari jalur pendek,3,3837,https://katalog.ukdw.ac.id/1058/
