,judul,abstrak,kata_kunci,subjek,abstrak_baru,mix_feature,cluster_tag_sklearn,id_mahasiswa,link
83,IMPLEMENTASI SISTEM PEMANTAU JARAK JAUH DETAK JANTUNG PASIEN,"Jantung merupakan organ vital dalam tubuh manusia dimana kesehatan jantung itu sendiri mencerminkan kondisi kesehatan tubuh orang tersebut. Kasus penyakit kronis yang berhubungan dengan jantung di Indonesia menurut data Kementrian Kesehatan Republik Indonesia pada tahun 2013 diestimasikan sebesar 1.606.000 kasus untuk usia 45 tahun keatas dimana jumlah kasus tertinggi terjadi pada usia 55 sampai 64 tahun. Kunjungan dokter yang tidak teratur dan kurangnya kesadaran pasien untuk melakukan pemantauan rutin karena merasa sehat membuat penanganan penyakit jantung menjadi terlambat. Oleh karena itu, dibangun sebuah sistem pemantau detak jantung pasien jarak jauh berbasis Internet of Things (IoT) yang dapat berkomunikasi dengan perangkat pengguna lain menggunakan cloud storage firebase untuk menyimpan data detak jantung pasien yang ditangkap oleh sensor. Pengambilan data detak jantung menggunakan sensor Pulse Heart Rate Sensor XD-58C yang menggunakan green light untuk menghitung perubahan volume darah pada pembuluh darah. Sensor Pulse Heart Rate Sensor XD-58C memiliki hasil rata - rata berbeda dengan pengambilan denyut nadi secara manual sebesar 4,3 denyut per menit dengan kecepatan pengiriman data dari sensor ke firebase di bawah 1 detik dengan tingkat akurasi alat sebesar 86,57%.","IoT, Denyut jantung, Sensor, Firebase","Q Science > QA Mathematics > QA75 Electronic computers. Computer science
Q Science > QA Mathematics > QA76 Computer software
R Medicine > R Medicine (General)",jantung organ vital tubuh manusia sehat jantung cermin kondisi sehat tubuh sakit kronis hubung jantung indonesia data tri sehat republik indonesia tahun 2013 estimasi 1 606 000 usia 45 tahun tinggi usia 55 64 tahun kunjung dokter atur sadar pasien pantau rutin sehat tangan sakit jantung lambat bangun buah sistem pantau detak jantung pasien jarak bas internet of things iot komunikasi perangkat cloud storage firebase simpan data detak jantung pasien tangkap sensor ambil data detak jantung sensor pulse heart rate sensor xd-58c green light hitung ubah volume darah buluh darah sensor pulse heart rate sensor xd-58c milik hasil rata - rata beda ambil denyut nadi manual 4 3 denyut menit cepat kirim data sensor firebase 1 detik tingkat akurasi alat 86 57,implementasi pantau jarak detak jantung pasien jantung organ vital tubuh manusia sehat jantung cermin kondisi sehat tubuh sakit kronis hubung jantung indonesia data tri sehat republik indonesia tahun 2013 estimasi 1 606 000 usia 45 tahun tinggi usia 55 64 tahun kunjung dokter atur sadar pasien pantau rutin sehat tangan sakit jantung lambat bangun buah pantau detak jantung pasien jarak bas internet of things iot komunikasi perangkat cloud storage firebase simpan data detak jantung pasien tangkap sensor ambil data detak jantung sensor pulse heart rate sensor xd-58c green light hitung ubah volume darah buluh darah sensor pulse heart rate sensor xd-58c milik rata - rata beda ambil denyut nadi manual 4 3 denyut menit cepat kirim data sensor firebase 1 detik akurasi alat 86 57 iot denyut jantung sensor firebase,3,3852,https://katalog.ukdw.ac.id/6805/
84,PENERAPAN DESAIN JARINGAN LORA BERBASIS APLIKASI IoT PADA SISTEM MONITORING AKTIVITAS PENGAWASAN GEDUNG,"Di Universitas Kristen Duta Wacana, terdapat satpam yang bertugas menjaga beberapa lokasi sesuai dengan jadwalnya. Saat satpam tersebut selesai menjaga lokasi tersebut, maka satpam harus kembali ke kantor pusat untuk melaporkan kejadian pada lokasi tersebut. Setelah itu satpam dapat melanjutkan ke titik berikutnya. Hal tersebut tentu tidak efektif, karena satpam harus bolak-balik ke kantor pusat hanya untuk melaporkan kejadian. Oleh karena itu, dibuatlah sebuah penelitian untuk mengembangkan sistem monitoring aktivitas pengawasan gedung berbasis aplikasi IoT menggunakan koneksi WiFi. Namun sistem tersebut akan sulit diimplementasikan di UKDW, karena UKDW terdiri dari banyak gedung sehingga apabila mengandalkan koneksi WiFi yang hanya dapat menjangkau belasan meter saja, maka akan sulit untuk melakukan pengiriman data. Selain itu, pengembangan sistem ini juga memakan biaya yang cukup tinggi serta daya yang cukup tinggi juga karena harus memastikan setiap titik jaga satpam harus menjangkau koneksi WiFi. Berangkat dari masalah tersebut, penulis membuat penelitian untuk mengembangkan jaringan LoRa yang akan diterapkan pada sistem tersebut. Selain jaringan LoRa, penulis juga melakukan pengembangan web admin, back-end keseluruhan sistem, serta script python. Tujuan yang ingin dicapai pada penelitian ini adalah menerapkan desain jaringan LoRa berbasis aplikasi IoT pada sistem monitoring aktivitas pengawasan
gedung serta mengevaluasi performa dari jaringan tersebut.
Manfaat yang didapatkan dari penelitian ini adalah dapat meningkatkan efektivitas kinerja satpam dalam menjaga lokasi dan memudahkan supervisor satpam dalam mengevaluasi keamanan di UKDW melalui halaman admin yang dapat menampilkan laporan keseluruhan penjagaan satpam.","Internet of Things, Penjadwalan satpam, LoRa, MQTT, QRCode, WiFi module, microcontroller, NodeMCU ESP8266, python, laravel, VueJS","Q Science > QA Mathematics > QA75 Electronic computers. Computer science
T Technology > T Technology (General)",universitas kristen duta wacana satpam tugas jaga lokasi sesuai jadwal satpam selesai jaga lokasi satpam kantor pusat lapor lokasi satpam titik efektif satpam bolak-balik kantor pusat lapor buah teliti kembang sistem monitoring aktivitas awas gedung bas aplikasi iot koneksi wifi sistem sulit implementasi ukdw ukdw gedung andal koneksi wifi jangkau bas meter sulit kirim data kembang sistem makan biaya tinggi daya tinggi titik jaga satpam jangkau koneksi wifi berangkat tulis teliti kembang jaring lora terap sistem jaring lora tulis kembang web admin back-end sistem script python capai teliti terap desain jaring lora bas aplikasi iot sistem monitoring aktivitas awas gedung evaluasi performa jaring manfaat teliti tingkat efektivitas satpam jaga lokasi mudah supervisor satpam evaluasi aman ukdw halaman admin tampil lapor jaga satpam,terap desain jaring lora bas aplikasi iot monitoring aktivitas awas gedung universitas kristen duta wacana satpam tugas jaga lokasi sesuai jadwal satpam selesai jaga lokasi satpam kantor pusat lapor lokasi satpam titik efektif satpam bolak-balik kantor pusat lapor buah kembang monitoring aktivitas awas gedung bas aplikasi iot koneksi wifi sulit implementasi ukdw ukdw gedung andal koneksi wifi jangkau bas meter sulit kirim data kembang makan biaya tinggi daya tinggi titik jaga satpam jangkau koneksi wifi berangkat tulis kembang jaring lora terap jaring lora tulis kembang web admin back-end script python capai terap desain jaring lora bas aplikasi iot monitoring aktivitas awas gedung evaluasi performa jaring manfaat efektivitas satpam jaga lokasi mudah supervisor satpam evaluasi aman ukdw halaman admin tampil lapor jaga satpam internet of things jadwal satpam lora mqtt qrcode wifi module microcontroller nodemcu esp8266 python laravel vuejs,0,4013,https://katalog.ukdw.ac.id/4220/
85,PEMODELAN OBJEK BUDAYA SASTRA INDONESIA BERBASIS SEMANTIC WEB,"Sastra merupakan wadah seni menampilkan keindahan lewat penggunaan bahasa yang menarik, bervariasi dan penuh imajinasi. Ada tiga jenis karya sastra di Indonesia yaitu: prosa, puisi, dan drama. Selain jenis, sastra juga memiliki periodisasi angkatan. Untuk mendapatkan informasi mengenai objek budaya, dapat diterapkan teknologi informasi dan komunikasi (TIK). TIK saat ini dapat membantu masyarakat untuk mencari suatu informasi mengenai objek budaya tersebut dengan  menggunakan beberapa pendekatan, salah satunya adalah semantic web. Dengan memanfaatkan semantic web, informasi tentang sastra Indonesia direpresentasikan dalam bentuk ontologi. Dalam penelitian ini, ontologi dibangun dengan menggunakan metodologi  Methontology. Metodologi Methontology dalam penelitian ini terdiri dari 4 tahapan, yaitu spesifikasi, knowledge acquisition, konseptualisasi dan implementasi. Tahap spesifikasi adalah menentukan ruang lingkup ontologi dari objek budaya. Tahap knowledge acquisition adalah menganalisis teks informal, untuk mempelajari konsep-konsep utama yang ada dalam buku. Tahap konseptualisasi adalah melakukan ekstraksi dengan cara menerapkan N-triple yaitu subjek, predikat, dan objek. Dalam tahap konseptual akan dihasilkan juga diagram T-box untuk pemodelan objek. Tahap implementasi adalah membangun ontologi objek budaya Sastra Indonesia kedalam bentuk OWL menggunakan aplikasi protégé. Informasi sastra indonesia dibangun dengan menggunakan bahasa pemrograman JavaScript dengan framework Vue.js. Dalam pemrograman web berbasis semantic web dalam penelitian ini dapat menghubungkan resource Sastra Indonesia dengan resources id.dbpedia.org dengan menggunakan endpoint dbpedia Indonesia. Penelitian ini melaporkan hasil dari tahap spesifikasi, knowledge acquisition, konseptualisasi dan implementasi. Hasil akhir penelitian ini adalah representasi pengetahuan sastra Indonesia berbasis OWL dalam semantic web.","semantic web, methontology, ontologi, sastra, Indonesia, endpoint, id.dbpedia.org, protégé","P Language and Literature > PL Languages and literatures of Eastern Asia, Africa, Oceania
Q Science > QA Mathematics > QA75 Electronic computers. Computer science",sastra wadah seni tampil indah bahasa tarik variasi penuh imajinasi jenis karya sastra indonesia prosa puisi drama jenis sastra milik periodisasi angkat informasi objek budaya terap teknologi informasi komunikasi tik tik bantu masyarakat cari informasi objek budaya salah semantic web manfaat semantic web informasi sastra indonesia representasi bentuk ontologi teliti ontologi bangun metodologi methontology metodologi methontology teliti 4 tahap spesifikasi knowledge acquisition konseptualisasi implementasi tahap spesifikasi ruang lingkup ontologi objek budaya tahap knowledge acquisition analis teks informal ajar konsep utama buku tahap konseptualisasi ekstraksi terap n-triple subjek predikat objek tahap konseptual hasil diagram t-box model objek tahap implementasi bangun ontologi objek budaya sastra indonesia bentuk owl aplikasi prot informasi sastra indonesia bangun bahasa pemrograman javascript framework vue js pemrograman web bas semantic web teliti hubung resource sastra indonesia resources id dbpedia org endpoint dbpedia indonesia teliti lapor hasil tahap spesifikasi knowledge acquisition konseptualisasi implementasi hasil teliti representasi sastra indonesia bas owl semantic web,model objek budaya sastra indonesia bas semantic web sastra wadah seni tampil indah bahasa tarik variasi penuh imajinasi jenis karya sastra indonesia prosa puisi drama jenis sastra milik periodisasi angkat objek budaya terap teknologi komunikasi tik tik bantu masyarakat cari objek budaya salah semantic web manfaat semantic web sastra indonesia representasi bentuk ontologi ontologi bangun metodologi methontology metodologi methontology 4 tahap spesifikasi knowledge acquisition konseptualisasi implementasi tahap spesifikasi ruang lingkup ontologi objek budaya tahap knowledge acquisition analis teks informal ajar konsep utama buku tahap konseptualisasi ekstraksi terap n-triple subjek predikat objek tahap konseptual diagram t-box model objek tahap implementasi bangun ontologi objek budaya sastra indonesia bentuk owl aplikasi prot sastra indonesia bangun bahasa pemrograman javascript framework vue js pemrograman web bas semantic web hubung resource sastra indonesia resources id dbpedia org endpoint dbpedia indonesia lapor tahap spesifikasi knowledge acquisition konseptualisasi implementasi representasi sastra indonesia bas owl semantic web semantic web methontology ontologi sastra indonesia endpoint id dbpedia org prot,5,3927,https://katalog.ukdw.ac.id/1129/
86,PEMBUATAN WEB SISTEM INFORMASI JEMAAT PADA GEREJA GKI IMANNUEL SERUI KOTA,"Sistem informasi di suatu organinsasi dirancang untuk menangani pengolahan data organisasi berupa informasi kegiatan didalam suatu organisasi secara terkomputerisasi sehingga memudahkan untuk meningkatkan kebutuhan administrasi. Sistem informasi pelayanan Jemaat Gereja Gki Imannuel Serui Kota berbasis web yang dapat membantu bagian administrasi gereja dalam mengolah data gereja seperti: diakonia, kegiatan jemaat imanuael Serui Kota, pendeta, keluarga dan semua kegiatan yang sudah dilakukan maupun akan dilakukan. Dan ketika akan melakukan penambahan, pencarian informasi seputar gereja dapat dilakukan dengan mudah, sehingga meningkatkan kualitas pelayanan Gereja Gki Imannuel Serui Kota, dan memudahkan jemaat untuk mengetahui segala informasi yang dilakukan oleh pemimpin gereja yang mudah dikelola. Dengan menggunakan metode User Centered Design (UCD) yang berfokus kepada pengguna pada pekerjaan yang dilakukan dimana pekerjaan ini merupakan kunci untuk mengoptimalkan proses antara pengguna akhir. Jadi penelitian yang dilakukan oleh penulis ini bermaksud untuk membuat sistem informasi jemaat Gereja Gki Imannuel Serui Kota berbasis web untuk memperhatikan interface juga didalam sistem agar mudah diakses dari yang muda hingga lansia. Hasil penelitian berdasarkan pengujian Black Box menghasilkan kesimpulan fungsional dan dapat dikatakan sesuai dengan kegunaanya, dan pengujian kepuasan pengguna menggunakan System Usability Scale (SUS) menujukan rata-rata persentase sebesar 70,375% dan dapat disimpulkan bahwa sistem informasi Gereja Gki Imannuel Serui Kota dapat di terima dengan baik.","Sistem informasi, UCD, Black box, SUS","B Philosophy. Psychology. Religion > BR Christianity
Q Science > QA Mathematics > QA76 Computer software
T Technology > T Technology (General)",sistem informasi organinsasi rancang tangan olah data organisasi upa informasi giat organisasi komputerisasi mudah tingkat butuh administrasi sistem informasi layan jemaat gereja gki imannuel serui kota bas web bantu administrasi gereja olah data gereja diakonia giat jemaat imanuael serui kota pendeta keluarga giat cari informasi putar gereja mudah tingkat kualitas layan gereja gki imannuel serui kota mudah jemaat informasi pimpin gereja mudah kelola metode user centered design ucd fokus kunci optimal proses teliti tulis sistem informasi jemaat gereja gki imannuel serui kota bas web perhati interface sistem mudah akses muda lansia hasil teliti dasar uji black box hasil simpul fungsional sesuai kegunaanya uji puas system usability scale sus rata persentase 70 375 simpul sistem informasi gereja gki imannuel serui kota terima,web jemaat gereja gki imannuel serui kota organinsasi rancang tangan olah data organisasi upa giat organisasi komputerisasi mudah butuh administrasi layan jemaat gereja gki imannuel serui kota bas web bantu administrasi gereja olah data gereja diakonia giat jemaat imanuael serui kota pendeta keluarga giat cari putar gereja mudah kualitas layan gereja gki imannuel serui kota mudah jemaat pimpin gereja mudah kelola user centered design ucd fokus kunci optimal proses tulis jemaat gereja gki imannuel serui kota bas web perhati interface mudah akses muda lansia dasar uji black box simpul fungsional sesuai kegunaanya uji puas usability scale sus rata persentase 70 375 simpul gereja gki imannuel serui kota terima ucd black box sus,1,3841,https://katalog.ukdw.ac.id/6808/
87,PEMBANGUNAN DATA WAREHOUSE DAN DASHBOARD UNTUK MENDUKUNG ANALISIS KRS DAN KHS MAHASISWA,"Data-data yang berkaitan dengan perkuliahan dihasilkan setiap harinya. Setiap mahasiswa yang terdaftar memiliki lebih dari satu data setiap semesternya. Data awal perkuliahan berupa Kartu Rencana Studi (KRS) maupun data akhir perkuliahan yang berupa Kartu Hasil Studi (KHS). Setiap data yang ada harus tersimpan sebagai rekap untuk kegiatan administrasi sebuah instansi perguruan tinggi untuk rencana strategis maupun untuk laporan penilaian akreditasi sebuah institusi perguruan tinggi. Penelitian ini akan membantu Kaprodi dalam menganalisis data dari setiap indikator yang telah ditetapkan melalui dashboard sebagai media untuk memvisualisasikan data. Antar muka dashboard dibangun menggunakan metode Goal-Directed design. Pada tahap research dilakukan wawancara dengan Kaprodi Informatika dan Pegawai Pendukung Akademik (Staff PPA) bagian akademik. Pengujian User Interface dashboard dilakukan dengan menggunakan metode Performance Metric menghasilkan 71% pada pengujian binary success dari 14 responden terpilih. Evaluasi User Experience pengguna menggunakan kuesioner User Experience Questionnaire (UEQ) dengan hasil excellent pada skala daya tarik dengan nilai 1.96, stimulasi dengan nilai 1.93, dan kebaharuan dengan nilai 1.77. Sedangkan hasil good pada skala kejelasan dengan nilai 1,88 dan efisiensi dengan nilai 1,86.","KRS & KHS, Goal-Directed design, performance metric, KPI, Dashboard","Q Science > QA Mathematics > QA75 Electronic computers. Computer science
Z Bibliography. Library Science. Information Resources > ZA Information resources > ZA4450 Databases",data kait kuliah hasil mahasiswa daftar milik data semester data kuliah upa kartu rencana studi krs data kuliah upa kartu hasil studi khs data simpan rekap giat administrasi buah instansi guru tinggi rencana strategis lapor nilai akreditasi buah institusi guru tinggi teliti bantu kaprodi analis data indikator dashboard media visualisasi data muka dashboard bangun metode goal-directed design tahap research wawancara kaprodi informatika pegawai dukung akademik staff ppa akademik uji user interface dashboard metode performance metric hasil 71 uji binary success 14 responden pilih evaluasi user experience kuesioner user experience questionnaire ueq hasil excellent skala daya tarik nilai 1 96 stimulasi nilai 1 93 baharu nilai 1 77 hasil good skala nilai 1 88 efisiensi nilai 1 86,bangun data warehouse dashboard dukung krs khs mahasiswa data kait kuliah mahasiswa daftar milik data semester data kuliah upa kartu rencana studi krs data kuliah upa kartu studi khs data simpan rekap giat administrasi buah instansi guru tinggi rencana strategis lapor akreditasi buah institusi guru tinggi bantu kaprodi analis data indikator dashboard media visualisasi data muka dashboard bangun goal-directed design tahap research wawancara kaprodi informatika pegawai dukung akademik staff ppa akademik uji user interface dashboard performance metric 71 uji binary success 14 responden pilih evaluasi user experience kuesioner user experience questionnaire ueq excellent skala daya tarik 1 96 stimulasi 1 93 baharu 1 77 good skala 1 88 efisiensi 1 86 krs khs goal-directed design performance metric kpi dashboard,5,3884,https://katalog.ukdw.ac.id/4167/
88,SISTEM PENDUKUNG KEPUTUSAN PEMILIHAN MAKANAN PADA APLIKASI PESAN MAKANAN ONLINE MENGGUNAKAN METODE AHP-TOPSIS,"Pangan merupakan salah satu kebutuhan utama hidup manusia. Semakin berkembangnya zaman, pangan dengan berbagai macam inovasi pengolahan dapat dengan mudah ditemukan di mana-mana. Sekarang ini, sudah ada penyedia jasa pesan antar makanan atau delivery order yang memudahkan pengguna dalam membeli makanan. Tetapi kerap kali muncul keadaan yang dinamakan overchoice atau choice overload, yaitu pengguna bingung ingin memesan makanan apa dikarenakan banyaknya menu makanan yang tersedia dan mood pengguna yang tidak jelas ingin memakan apa. Overchoice atau choice overload adalah proses kognitif dimana orang mengalami kesulitan dalam mengambil keputusan karena terlalu banyak pilihan.  Dalam penelitian ini, penulis membuat satu aplikasi berbasis android menggunakan java programming language dengan mengimplementasikan metode Analytic Hierarchy Process (AHP) dan metode Technique for Order Preference by Similarity to Ideal Solution (TOPSIS). Pengguna nantinya dapat memilih 3 menu makanan yang diinginkan dan melakukan pembobotan berdasarkan kriteria pada menu makanan tersebut. Lalu bobot yang diberikan oleh pengguna akan dihitung sehingga menghasilkan output ranking makanan dari menu yang dipilih. Pada pengujiannya, hasil perhitungan yang dilakukan oleh sistem menghasilkan nilai yang sama dengan perhitungan yang dilakukan secara manual. Sebanyak 93,3% responden setuju dengan ranking makanan yang dihasilkan dari perhitungan menggunakan metode AHP dan TOPSIS.","Overchoice, Choice overload, AHP, TOPSIS, Android, Java, Perankingan",Q Science > QA Mathematics > QA75 Electronic computers. Computer science,pangan salah butuh utama hidup manusia kembang zaman pangan inovasi olah mudah temu sedia jasa pesan makan delivery order mudah beli makan kerap muncul nama overchoice choice overload bingung mes makan menu makan sedia mood makan overchoice choice overload proses kognitif alami sulit ambil putus pilih teliti tulis aplikasi bas android java programming language implementasi metode analytic hierarchy process ahp metode technique for order preference by similarity to ideal solution topsis pilih 3 menu makan bobot dasar kriteria menu makan bobot hitung hasil output ranking makan menu pilih uji hasil hitung sistem hasil nilai hitung manual 93 3 responden ranking makan hasil hitung metode ahp topsis,dukung putus pilih makan aplikasi pesan makan online ahp-topsis pangan salah butuh utama hidup manusia kembang zaman pangan inovasi olah mudah temu sedia jasa pesan makan delivery order mudah beli makan kerap muncul nama overchoice choice overload bingung mes makan menu makan sedia mood makan overchoice choice overload proses kognitif alami sulit ambil putus pilih tulis aplikasi bas android java programming language implementasi analytic hierarchy process ahp technique for order preference by similarity to ideal solution topsis pilih 3 menu makan bobot dasar kriteria menu makan bobot hitung output ranking makan menu pilih uji hitung hitung manual 93 3 responden ranking makan hitung ahp topsis overchoice choice overload ahp topsis android java perankingan,1,3930,https://katalog.ukdw.ac.id/6255/
