,judul,abstrak,kata_kunci,subjek,abstrak_baru,mix_feature,cluster_tag_sklearn,id_mahasiswa,link
42,PENGEMBANGAN MEJA KESELAMATAN PADA BENCANA GEMPA BUMI,"Indonesia khususnya di Yogyakarta merupakan daerah yang berpotensi terjadi gempa bumi jenis tektonik. Sejak gempa tahun 2006, Yogyakarta mulai mencanangkan program tangguh bencana. Salah satu yang menjadi perhatian adalah sekolah, khususnya sekolah berkebutuhan khusus untuk para physical impairment bagian bawah. Dari situasi yang didapatkan di sekolah berkebutuhan khusus, didapatkan bahwa guru yang mendampingi proses belajar mengajar tidak dapat memenuhi aktifitas penyelamatan Ketika gempa bumi datang. Oleh karena itu tim dari Universitas Kristen Duta Wacana membuat suatu alat penyelamatan yang di beri nama TRIABLE. Alat ini di buat berdasarkan 2 metode penyelamatan untuk gempa bumi yaitu drop-cover-hold on (DCH) dan tringale of life. Alat ini di desain untuk menahan reruntuhan bangunan dan dapat memudahkan difable untuk berlindung dari bahaya akibat gempa bumi. TRIABLE dikembangkan tim dari Universitas Kristen Duta Wacana untuk mengikuti gelaran Pertemuan Ilmiah Tahunan (PIT) ke-6 di Sentul, Bogor dan membuahkan hasil juara ke-3. Untuk meningkatkan kinerja sistem pada TRIABLE maka dilakukan pengembangan pada modul. Pengembangan tersebut berupa penambahan modul sinyal GSM , modul Bluetooth dan modul speaker. Penambahan modul ini dimaksudkan untuk meningkatkan efektifitas tim SAR dan warga dalam mencari korban bencana gempa bumi. Semua modul pada sistem meja TRIABLE dikontrol oleh mikrokontroller NodeMCU. Sinyal Bluetooth nantinya akan ditangkap menggunakan aplikasi yang di buat pada platform android.   Setelah dilakukan pengujian pada sistem TRIABLE, dihasilkan tingkat keberhasilan yang cukup memuaskan. Untuk pengiriman sms melalui modul GSM diperoleh tingkat keberhasilan 100%. Untuk penangkapan sinyal Bluetooth jika tidak terhalang diperoleh tingkat keberhasilan 100% jika terhalang tembok diperoleh tingkat keberhasilan 60%.","TRIABLE, drop cover hold on, triangle of life, physical impairment, NodeMCU ESP8266, modul GSM, modul Bluetooth, Android","G Geography. Anthropology. Recreation > G Geography (General)
T Technology > T Technology (General)",indonesia yogyakarta daerah potensi gempa bumi jenis tektonik gempa tahun 2006 yogyakarta canang program tangguh bencana salah perhati sekolah sekolah butuh physical impairment situasi sekolah butuh guru damping proses ajar ajar penuh aktifitas selamat gempa bumi tim universitas kristen duta wacana alat selamat nama triable alat dasar 2 metode selamat gempa bumi drop-cover-hold on dch tringale of life alat desain tahan runtuh bangun mudah difable lindung bahaya akibat gempa bumi triable kembang tim universitas kristen duta wacana gelar temu ilmiah tahun pit ke-6 sentul bogor buah hasil juara ke-3 tingkat sistem triable kembang modul kembang upa modul sinyal gsm modul bluetooth modul speaker modul tingkat efektifitas tim sar warga cari korban bencana gempa bumi modul sistem meja triable kontrol mikrokontroller nodemcu sinyal bluetooth tangkap aplikasi platform android uji sistem triable hasil tingkat hasil muas kirim sms modul gsm tingkat hasil 100 tangkap sinyal bluetooth halang tingkat hasil 100 halang tembok tingkat hasil 60,kembang meja selamat bencana gempa bumi indonesia yogyakarta daerah potensi gempa bumi jenis tektonik gempa tahun 2006 yogyakarta canang program tangguh bencana salah perhati sekolah sekolah butuh physical impairment situasi sekolah butuh guru damping proses ajar ajar penuh aktifitas selamat gempa bumi tim universitas kristen duta wacana alat selamat nama triable alat dasar 2 selamat gempa bumi drop-cover-hold on dch tringale of life alat desain tahan runtuh bangun mudah difable lindung bahaya akibat gempa bumi triable kembang tim universitas kristen duta wacana gelar temu ilmiah tahun pit ke-6 sentul bogor buah juara ke-3 triable kembang modul kembang upa modul sinyal gsm modul bluetooth modul speaker modul efektifitas tim sar warga cari korban bencana gempa bumi modul meja triable kontrol mikrokontroller nodemcu sinyal bluetooth tangkap aplikasi platform android uji triable muas kirim sms modul gsm 100 tangkap sinyal bluetooth halang 100 halang tembok 60 triable drop cover hold on triangle of life physical impairment nodemcu esp8266 modul gsm modul bluetooth android,0,4016,https://katalog.ukdw.ac.id/6279/
43,EVALUASI ANTARMUKA B2C SITUS WEB MYGOMODO.COM DENGAN UJI USABILITAS,"Mygomodo.com merupakan salah satu situs jual beli produk jasa dan wisata. Sebagai situs yang mendapatkan keuntungan dari penjualan produk jasa dan wisata yang ditawarkan, pengalaman pengunjung situs dalam berinteraksi dengan situs menjadi salah satu hal yang penting. Oleh sebab itu, pengujian diperlukan untuk mengukur tingkat usabilitas perlu dilakukan pada situs ini. Dalam penelitian ini, pengujian usabilitas pada situs web B2C mygomodo.com dilakukan dengan melakukan pengukuran time on task, error, task success, efficiency, dan System Usability Scale. Pengukuran time on task dilakukan dengan cara mengukur waktu yang dibutuhkan responden untuk mengerjakan task scenario. Pengukuran error dilakukan dengan cara menghitung jumlah kesalahan yang dilakukan responden dalam mengerjakan task scenario. Pengukuran task success dilakukan dengan cara melihat apakah responden berhasil memilih produk sesuai dengan task scenario. Pengukuran efisiensi dilakukan dengan cara melakukan penghitungan terhadap hasil data time on task dan task success. Berdasarkan pengujian yang dilakukan, didapatkan hasil time on task sebesar rata-rata 202.17 detik untuk responden berulang dan 229.45 detik untuk responden baru, hasil error rate sebesar 0.11 untuk responden berulang dan 0.3 untuk responden baru, hasil task success sebesar 92% untuk responden berulang dan 87% untuk responden baru, tingkat efisiensi sebesar 89.1729% untuk responden berulang dan 81.1942% untuk responden baru, dan skor SUS sebesar 80.5556 untuk responden berulang dan 72.5 untuk responden baru.","Usability Testing, Performance Based Metrics, System Usability Scale","H Social Sciences > HA Statistics
Q Science > QA Mathematics
Q Science > QA Mathematics > QA76 Computer software",mygomodo com salah situs jual beli produk jasa wisata situs untung jual produk jasa wisata tawar alam unjung situs interaksi situs salah uji ukur tingkat usabilitas situs teliti uji usabilitas situs web b2c mygomodo com ukur time on task error task success efficiency system usability scale ukur time on task ukur waktu butuh responden task scenario ukur error hitung salah responden task scenario ukur task success responden hasil pilih produk sesuai task scenario ukur efisiensi hitung hasil data time on task task success dasar uji hasil time on task rata 202 17 detik responden ulang 229 45 detik responden hasil error rate 0 11 responden ulang 0 3 responden hasil task success 92 responden ulang 87 responden tingkat efisiensi 89 1729 responden ulang 81 1942 responden skor sus 80 5556 responden ulang 72 5 responden,evaluasi antarmuka b2c situs web mygomodo com uji usabilitas mygomodo com salah situs jual beli produk jasa wisata situs untung jual produk jasa wisata tawar alam unjung situs interaksi situs salah uji ukur usabilitas situs uji usabilitas situs web b2c mygomodo com ukur time on task error task success efficiency usability scale ukur time on task ukur waktu butuh responden task scenario ukur error hitung salah responden task scenario ukur task success responden pilih produk sesuai task scenario ukur efisiensi hitung data time on task task success dasar uji time on task rata 202 17 detik responden ulang 229 45 detik responden error rate 0 11 responden ulang 0 3 responden task success 92 responden ulang 87 responden efisiensi 89 1729 responden ulang 81 1942 responden skor sus 80 5556 responden ulang 72 5 responden usability testing performance based metrics usability scale,0,3984,https://katalog.ukdw.ac.id/5028/
44,ANALISIS SENTIMEN PADA KOMENTAR VIDEO ULASAN SMARTPHONE DI YOUTUBE,"YouTube merupakan salah satu media sosial yang memiliki daya tarik yang tinggi di masyarakat. YouTube memiliki konten yang sangat beragam, penelitian ini menitikberatkan analisis sentimen komentar mengenai video ulasan smartphone di YouTube. Adapun channel YouTube yang digunakan sebagai sumber data adalah “Sobat HAPE” dan “DroidLime” yang merupakan channel pengulas
smartphone asal Indonesia yang sudah diverifikasi oleh YouTube. Sistem klasifikasi sentimen yang dibangun bertujuan untuk membantu pengguna dalam mengetahui bagaimana sentimen masyarakat terhadap suatu video ulasan smartphone.
Peneliti ini mencoba untuk menerapkan metode pembobotan term Credibility Adjusted Term Frequency (CATF) pada model klasifikasi Support Vector Machine (SVM) dengan menggunakan kernel linear dan RBF. Pada proses pengujian, peneliti membandingkan performa sistem klasifikasi untuk dataset dengan jumlah data komentar yang seimbang pada setiap kelasnya dan yang tidak seimbang. Selain itu, peneliti juga membandingkan performa kernel linear dan RBF. Parameter evaluasi yang digunakan pada penelitian ini adalah akurasi dan presisi yang didapatkan dari confusion matrix. CATF dapat digunakan sebagai metode pembobotan pada model klasifikasi SVM untuk klasifikasi sentimen komentar ulasan smartphone di YouTube. Sistem
ini menghasilkan nilai akurasi rata-rata tertinggi 79,2% pada data seimbang, dan 65,8% pada data tidak seimbang. Kernel linear menghasilkan sistem klasifikasi yang optimal dengan akurasi yang tinggi, meskipun begitu sistem klasifikasi yang seimbang diraih menggunakan kernel RBF.","Analisis Sentimen, Sistem Klasifikasi, Support Vector Machine,
Credibility Adjusted Term Frequency","Q Science > QA Mathematics > QA75 Electronic computers. Computer science
Q Science > QA Mathematics > QA76 Computer software",youtube salah media sosial milik daya tarik tinggi masyarakat youtube milik konten agam teliti menitikberatkan analisis sentimen komentar video ulas smartphone youtube channel youtube sumber data sobat hape droidlime channel ulas smartphone indonesia verifikasi youtube sistem klasifikasi sentimen bangun bantu sentimen masyarakat video ulas smartphone teliti coba terap metode bobot term credibility adjusted term frequency catf model klasifikasi support vector machine svm kernel linear rbf proses uji teliti banding performa sistem klasifikasi dataset data komentar imbang kelas imbang teliti banding performa kernel linear rbf parameter evaluasi teliti akurasi presisi confusion matrix catf metode bobot model klasifikasi svm klasifikasi sentimen komentar ulas smartphone youtube sistem hasil nilai akurasi rata tinggi 79 2 data imbang 65 8 data imbang kernel linear hasil sistem klasifikasi optimal akurasi tinggi sistem klasifikasi imbang raih kernel rbf,sentimen komentar video ulas smartphone youtube youtube salah media sosial milik daya tarik tinggi masyarakat youtube milik konten agam menitikberatkan sentimen komentar video ulas smartphone youtube channel youtube sumber data sobat hape droidlime channel ulas smartphone indonesia verifikasi youtube klasifikasi sentimen bangun bantu sentimen masyarakat video ulas smartphone coba terap bobot term credibility adjusted term frequency catf model klasifikasi support vector machine svm kernel linear rbf proses uji banding performa klasifikasi dataset data komentar imbang kelas imbang banding performa kernel linear rbf parameter evaluasi akurasi presisi confusion matrix catf bobot model klasifikasi svm klasifikasi sentimen komentar ulas smartphone youtube akurasi rata tinggi 79 2 data imbang 65 8 data imbang kernel linear klasifikasi optimal akurasi tinggi klasifikasi imbang raih kernel rbf sentimen klasifikasi support vector machine credibility adjusted term frequency,3,3887,https://katalog.ukdw.ac.id/520/
45,PENGEMBANGAN APLIKASI PENINJAU DATA JEMAAT DENGAN PERTIMBANGAN KEAMANAN PADA BASIS DATA GEREJA BERBASIS ANDROID,"Pendataan data jemaat merupakan proses yang penting, namun sulit. Data jemaat memiliki bentuk yang beragam dan banyak bagian yang perlu dicatat. Aplikasi yang memiliki akses mudah dan diakses secara mandiri dapat meningkatkan kecepatan dan akurasi pencatatan. Keterbatasan biaya dan tenaga menyebabkan perlunya penyediaan akses tanpa melakukan penyewaan VPS, maka DDNS bisa menjadi solusi permasalahan tersebut. Informasi yang bersifat sensitif, menyebabkan data tidak bisa dikomunikasikan tanpa keamanan, sehingga perlu juga penerapan TLS dan SSL. Penelitian ini sudah berhasil mengimplementasikan sistem yang dapat memenuhi kebutuhan dari mitra yaitu GKI. DDNS diterapkan dengan konfigurasi di penyedia layanan DDNS NoIp dan konfigurasi pada modem, sehingga akses dapat tersedia. Akses tersebut diarahkan ke web service SiswaWS yang menyediakan akses ke basis data lokal di komputer gereja. SiswaWS dibangun dengan menggunakan framework Spring. Aplikasi yang mengakses berupa aplikasi berbasis android SiswaJR juga dibangun sebagai antarmuka pengguna web service.
Sistem yang dibangun sudah menyelesaikan permasalahan yang dirumuskan. Pemanfaatan DDNS dengan web service, telah berhasil memberikan akses, yang diakses dengan menggunakan sebuah aplikasi android SiswaJR. Keamanan data disediakan dengan adanya autentikasi dan penggunaan TLS dan SSL disertai internal CA. Pemenuhan kebutuhan fungsinya sudah diuji melalui pengujian secara mandiri yang divalidasi oleh seorang pihak GKI. Penelitian berikutnya dapat menekankan pada user experience karena jemaat dari GKI memiliki usia maupun etnis yang beragam. Pengujian terhadap keamanan juga bisa menjadi pengembangan pada penelitian berikutnya.","DDNS, TLS, SSL, gereja, web service, android","B Philosophy. Psychology. Religion > BR Christianity
Q Science > QA Mathematics > QA75 Electronic computers. Computer science",data data jemaat proses sulit data jemaat milik bentuk agam catat aplikasi milik akses mudah akses mandiri tingkat cepat akurasi catat batas biaya tenaga sedia akses sewa vps ddns solusi informasi sifat sensitif data komunikasi aman terap tls ssl teliti hasil implementasi sistem penuh butuh mitra gki ddns terap konfigurasi sedia layan ddns noip konfigurasi modem akses sedia akses arah web service siswaws sedia akses basis data lokal komputer gereja siswaws bangun framework spring aplikasi akses upa aplikasi bas android siswajr bangun antarmuka web service sistem bangun selesai rumus manfaat ddns web service hasil akses akses buah aplikasi android siswajr aman data sedia autentikasi tls ssl internal ca penuh butuh fungsi uji uji mandiri divalidasi gki teliti tekan user experience jemaat gki milik usia etnis agam uji aman kembang teliti,kembang aplikasi tinjau data jemaat timbang aman basis data gereja bas android data data jemaat proses sulit data jemaat milik bentuk agam catat aplikasi milik akses mudah akses mandiri cepat akurasi catat batas biaya tenaga sedia akses sewa vps ddns solusi sifat sensitif data komunikasi aman terap tls ssl implementasi penuh butuh mitra gki ddns terap konfigurasi sedia layan ddns noip konfigurasi modem akses sedia akses arah web service siswaws sedia akses basis data lokal komputer gereja siswaws bangun framework spring aplikasi akses upa aplikasi bas android siswajr bangun antarmuka web service bangun selesai rumus manfaat ddns web service akses akses buah aplikasi android siswajr aman data sedia autentikasi tls ssl internal ca penuh butuh fungsi uji uji mandiri divalidasi gki tekan user experience jemaat gki milik usia etnis agam uji aman kembang ddns tls ssl gereja web service android,3,3842,https://katalog.ukdw.ac.id/1098/
46,SISTEM PAKAR UNTUK DETEKSI TIPE DIET IDEAL BERBASIS WEB DENGAN METODE FORWARD CHAINING,Permasalahan gizi bagi sebagian orang merupakan permasalahan yang cukup serius. Masih belum banyak aplikasi atau situs yang menyediakan perhitungan gizi sekaligus mengkonsultasikan diet berdasarkan data karakteristik tubuh dan gejala yang dialami. Tujuan dari penelitian ini adalah membangun sistem pakar yang mampu mengakomodir perhitungan gizi dan gejala yang dialami pengguna dengan metode forward chaining untuk menentukan saran diet dan certainty factor untuk menentukan perkiraan diagnosis status kesehatan. Pembuatan sistem diawali dengan mengumpulkan data mulai dari hasil saran diet dan pertanyaan lalu mengumpulkan nilai kepercayaan dan nilai ketidakpercayaan dari seorang pakar. Penerapan metode forward chaining dan certainty factor pada penelitian ini terjadi pada saat memasukan basis pengetahuan kedalam mesin inferensi. Metode forward chaining adalah metode runut maju untuk mendapatkan hasil berdasarkan fakta-fakta. Metode certainty factor adalah metode untuk menguji tingkat kepastian suatu gejala terhadap hasil. Proses untuk mendapatkan saran diet dan gejala perkiraan diagnosis status gizi dari metode forward chaining dan certainty factor merupakan data yang akan diuji ke dalam basis pengetahuan pakar. Hasil dari penelitian ini adalah saran diet dan diagnosa gizi yang sesuai dengan pengetahuan pakar.,"forward chaining, sistem pakar, saran diet, komputer","Q Science > QA Mathematics > QA75 Electronic computers. Computer science
R Medicine > RA Public aspects of medicine > RA0421 Public health. Hygiene. Preventive Medicine",gizi serius aplikasi situs sedia hitung gizi konsultasi diet dasar data karakteristik tubuh gejala alami teliti bangun sistem pakar mengakomodir hitung gizi gejala alami metode forward chaining saran diet certainty factor diagnosis status sehat sistem kumpul data hasil saran diet kumpul nilai percaya nilai ketidakpercayaan pakar terap metode forward chaining certainty factor teliti pasu basis mesin inferensi metode forward chaining metode runut maju hasil dasar fakta metode certainty factor metode uji tingkat gejala hasil proses saran diet gejala diagnosis status gizi metode forward chaining certainty factor data uji basis pakar hasil teliti saran diet diagnosa gizi sesuai pakar,pakar deteksi tipe diet ideal bas web forward chaining gizi serius aplikasi situs sedia hitung gizi konsultasi diet dasar data karakteristik tubuh gejala alami bangun pakar mengakomodir hitung gizi gejala alami forward chaining saran diet certainty factor diagnosis status sehat kumpul data saran diet kumpul percaya ketidakpercayaan pakar terap forward chaining certainty factor pasu basis mesin inferensi forward chaining runut maju dasar fakta certainty factor uji gejala proses saran diet gejala diagnosis status gizi forward chaining certainty factor data uji basis pakar saran diet diagnosa gizi sesuai pakar forward chaining pakar saran diet komputer,4,4073,https://katalog.ukdw.ac.id/4221/
47,REPRESENTASI PENGETAHUAN UNTUK PERMAINAN TRADISIONAL INDONESIA BERBASIS SEMANTIC WEB,"Permainan tradisional mempunyai makna sesuatu (permainan) yang dilakukan dengan berpegang teguh pada norma dan adat kebiasaan yang ada secara turun-temurun dan dapat memberikan rasa puas atau senang bagi si pelaku. Informasi dan proses pencarian tentang permainan tradisional Indonesia pada era ini cukup sulit sehingga perlu adanya suatu sistem yang dapat merepresentasikan pengetahuan tentang permainan tradisional Indonesia. Salah satunya adalah semantic web yang merupakan suatu sistem yang dapat membantu proses pencarian informasi berbasis web. 
	Pada penelitian ini dilakukan pengembangan semantic web dengan Web Semantics Design Method (WSDM) yang terdiri dari 5 tahap yaitu Mission Statement Specification, Audience Modeling, Conceptual Modeling, Implementation Design dan Implementation. Pada tahap ekstraksi yang merupakan bagian dari Conceptual Modeling, dengan menggunakan literatur yang ada, peneliti membuat ulang suatu kalimat yang mengandung subjek, predikat dan objek yang selanjutnya subjek dan objek tersebut akan didefinisikan menjadi suatu class. Selanjutnya dibentuk T-box yang akan diterjemahkan ke description logic. Dan akhirnya pada tahap implementasi design dilakukan desain pada web untuk memudahkan proses pencarian mengenai permainan tradisional Indonesia.
	Hasil dan kesimpulan yang diperoleh dari penelitian ini yaitu metode WSDM (Web Semantic Design Method) dapat diterapkan dalam menampilkan pengetahuan permainan tradisional Indonesia, dan pegetahuan tentang permainan tradisional Indonesia dapat diterapkan dalam semantic web berbasis OWL.","Permainan Tradisional Indonesia, Semantic Web, WSDM","G Geography. Anthropology. Recreation > GV Recreation Leisure
Q Science > QA Mathematics > QA76 Computer software",main tradisional makna main pegang teguh norma adat turun puas senang si informasi proses cari main tradisional indonesia era sulit sistem representasi main tradisional indonesia salah semantic web sistem bantu proses cari informasi bas web teliti kembang semantic web web semantics design method wsdm 5 tahap mission statement specification audience modeling conceptual modeling implementation design implementation tahap ekstraksi conceptual modeling literatur teliti ulang kalimat kandung subjek predikat objek subjek objek definisi class bentuk t-box terjemah description logic tahap implementasi design desain web mudah proses cari main tradisional indonesia hasil simpul teliti metode wsdm web semantic design method terap tampil main tradisional indonesia pegetahuan main tradisional indonesia terap semantic web bas owl,representasi main tradisional indonesia bas semantic web main tradisional makna main pegang teguh norma adat turun puas senang si proses cari main tradisional indonesia era sulit representasi main tradisional indonesia salah semantic web bantu proses cari bas web kembang semantic web web semantics design method wsdm 5 tahap mission statement specification audience modeling conceptual modeling implementation design implementation tahap ekstraksi conceptual modeling literatur ulang kalimat kandung subjek predikat objek subjek objek definisi class bentuk t-box terjemah description logic tahap implementasi design desain web mudah proses cari main tradisional indonesia simpul wsdm web semantic design method terap tampil main tradisional indonesia pegetahuan main tradisional indonesia terap semantic web bas owl main tradisional indonesia semantic web wsdm,4,3928,https://katalog.ukdw.ac.id/1119/
48,"IDENTIFIKASI SIDIK JARI MENGGUNAKAN HASIL EKSTRAKSI
DARI METODE WAVELET HAAR","Makalah ini menjelaskan tentang bagaimana fitur energi wavelet haar dapat digunakan untuk mengidentifikasi sidik jari. Tujuan utama dari penelitian ini adalah untuk menguji tingkat keakuratan dari identifikasi sidik jari menggunakan fitur energi yang dihitung dengan euclidean distance. Sampel penelitian berjumlah 300 yang digunakan untuk 18 kali pengujian. Citra sidik jari yang telah diambil melewati prapemrosesan gambar terlebih dahulu. Sebelum dilakukan identifkasi sidik jari, pertama – tama citra yang telah dipra-proses akan dihitung fitur energi wavelet haarnya, setelah
fitur energi wavelet haar telah diperoleh dilakukan perhitungan euclidean distance untuk menhitung tingkat kemiripan dari citra sidik jari. Hasil penelitian menunjukkan bahwa sidik jari yang menggunakan 90 citra latih memiliki tingkat akurasi untuk level 1 adalah 18% untuk level 2 adalah 21%, untuk level 3 adalah 19%, untuk level 4 adalah 18%, untuk level 5 adalah 20% dan untuk level 6 adalah 32%. Hasil yang menggunakan 150 citra latih untuk level 1 adalah 17%, untuk level 2 adalah 20%, untuk level 3 adalah 21%, untuk level 4 adalah 18%, untuk level 5 adalah 23% dan untuk level 6 adalah 31%. Serta hasil yang menggunakan 210 citra latih untuk level 1 adalah 19%, untuk level 2 adalah 22%, untuk level 3 adalah 17%, untuk level 4 adalah 21%, untuk level 5
adalah 32% untuk level 6 adalah 24%.","Wavelet haar, Euclidean Distance, ekstraksi fitur, sidik jari","Q Science > QA Mathematics > QA75 Electronic computers. Computer science
Q Science > QM Human anatomy",makalah fitur energi wavelet haar identifikasi sidik jari utama teliti uji tingkat akurat identifikasi sidik jari fitur energi hitung euclidean distance sampel teliti 300 18 uji citra sidik jari ambil prapemrosesan gambar identifkasi sidik jari tama citra dipra-proses hitung fitur energi wavelet haarnya fitur energi wavelet haar hitung euclidean distance menhitung tingkat citra sidik jari hasil teliti sidik jari 90 citra latih milik tingkat akurasi level 1 18 level 2 21 level 3 19 level 4 18 level 5 20 level 6 32 hasil 150 citra latih level 1 17 level 2 20 level 3 21 level 4 18 level 5 23 level 6 31 hasil 210 citra latih level 1 19 level 2 22 level 3 17 level 4 21 level 5 32 level 6 24,identifikasi sidik jari ekstraksi wavelet haar makalah fitur energi wavelet haar identifikasi sidik jari utama uji akurat identifikasi sidik jari fitur energi hitung euclidean distance sampel 300 18 uji citra sidik jari ambil prapemrosesan gambar identifkasi sidik jari tama citra dipra-proses hitung fitur energi wavelet haarnya fitur energi wavelet haar hitung euclidean distance menhitung citra sidik jari sidik jari 90 citra latih milik akurasi level 1 18 level 2 21 level 3 19 level 4 18 level 5 20 level 6 32 150 citra latih level 1 17 level 2 20 level 3 21 level 4 18 level 5 23 level 6 31 210 citra latih level 1 19 level 2 22 level 3 17 level 4 21 level 5 32 level 6 24 wavelet haar euclidean distance ekstraksi fitur sidik jari,5,3918,https://katalog.ukdw.ac.id/2531/
